ID_USER,ID_QUESTION,Question_Category,Question_Description,USER_ANSWER,CORRECT_ANSWER,Duration
17,697,BI,"Siapkah Indonesia Beralih ke Kendaraan Listrik? Sebagai upaya untuk mengurangi tingkat polusi yang disebabkan oleh penggunaan kendaraan yang berbahan bakar minyak (BBM), masyarakat mulai terdorong dan beralih menggunakan kendaraan listrik yang lebih ramah lingkungan daripada kendaraan konvensional berbahan bakar minyak. Hasil penelitian memang menunjukkan bahwa kendaraan berbahan bakar minyak merupakan penyumbang utama polusi udara berupa karbon monoksida (CO), hidrokarbon (HC), nitrogen oksida (NO), dan debu. Selain itu, cadangan BBM yang terus mengalami penurunan juga menjadi salah satu alasan mengapa banyak masyarakat beralih ke kendaraan listrik. Pemerintah Indonesia mendukung peralihan kendaraan ber-BBM ke kendaraan listrik. Indonesia sudah membuat peta jalan (roadmap) pengembangan industri Kendaraan Bermotor Listrik Berbasis Baterai (KBLBB) melalui Peraturan Menteri Perindustrian Nomor 27 Tahun 2020. Peraturan tersebut disusun sebagai petunjuk bagi pihak-pihak terkait, seperti pelaku industri otomotif, produsen baterai, dan konsumen. Selain peraturan, dukungan pemerintah juga dibuktikan dengan telah disusunnya kebijakan yang memudahkan dan meringankan masyarakat dalam hal kepemilikan kendaraan listrik, seperti pengenaan Pajak Pertambahan Nilai Barang Mewah (PPnBM) sebesar 0% , pajak atas penyerahan hak milik kendaraan bermotor (BBN-KB) sebesar 0% untuk KBLBB di Pemprov DKI Jakarta, BBN-KB sebesar 10% mobil listrik dan 2,5% sepeda motor listrik di Pemprov Jawa Barat, uang muka minimum sebesar 0% dan suku Bungan rendah untuk kendaraan listrik. Dari sisi produsen, pemerintah memberikan kemudahan/keringanan berupa tax holiday, tax allowance (PP 18/2015 Jo PP 9/2016, Permenperin 1/2018), pembebasan bea masuk (PMK 188/2015), bea masuk ditanggung pemerintah, serta super tax deduction untuk kegiatan R&D (PP 45/2019 dan PMK No. 153/2020).
Pernyataan manakah yang sesuai dengan isi teks tersebut?",3,0,102
17,948,PM,"Banyak siswa kelas A adalah 30 dan kelas B adalah 20 siswa. Nilai rata-rata ujian Matematika kelas A lebih 10 dari kelas B. Jika rata-rata nilai ujian Matematika gabungan dari kelas A dan kelas B adalah 66, maka rata-rata nilai ujian Matematika kelas B adalah ....",3,1,92
17,833,EN,"Conflicts had existed between Spain and England since the 1570s. England wanted a  share of the wealth that Spain had been taking from the land it had claimed in the Americas. In order to fulfill her desire, Elizabeth I, Queen of England, encouraged her staunch  admiral of the navy, Sir Francis Drake, to raid Spanish ships and towns. Though these raids were  on a small scale, Drake achieved dramatic success, adding gold and silver to England’s treasury  and diminishing Spain’s supremacy. 
Religious differences also caused conflict between the two countries. Whereas Spain was  Roman Catholic, most of England had become Protestant. King Philip II of Spain wanted to  claim the throne and make England a Catholic country again. To satisfy his ambition and also to  retaliate against England’s theft of his gold and silver, King Philip began to build his fleet of  warships, the Spanish Armada, in January 1586. 
Philip intended his fleet to be indestructible. In addition to building new warships, he  marshaled 130 sailing vessels of all types and recruited more than 19,000 robust soldiers and  8,000 sailors. Although some of his ships lacked guns and others lacked ammunition, Philip was  convinced that his Armada could withstand any battle with England.
The martial Armada set sail from Lisbon, Portugal, on May 9, 1588, but bad weather  forced it back to port. Their course was still unchanged, only postponed. Later, the voyage  resumed once more on July 22 after the weather became more stable. 
The Spanish fleet met the smaller, faster, and more maneuverable English ships in battle  off the coast of Plymouth, England, first on July 31 and again on August 2. The two battles left  Spain vulnerable, having lost several ships and with its ammunition depleted. On August 7,  while the Armada laid an anchor on the French side of the Strait of Dover, England sent eight  burning ships into the midst of the Spanish fleet to set it on fire. Blocked on one side, the 
Spanish ships could only drift away. Their crews were in panic and disorder. Before the Armada  could regroup, the English attacked again on August 8. 
Although the Spaniards made a valiant effort to fight back, the fleet suffered extensive  damage. During the eight hours of battle, the Armada drifted perilously close to the rocky  coastline. At the moment when it seemed that the Spanish ships would be driven onto the  English shore, the wind shifted, and the Armada drifted out into the North Sea. The Spaniards  recognized the superiority of the English fleet and returned home, defeated.
Who will get the most benefit by reading the passage? ",0,0,26
17,723,BI,"(1) Kondisi kesehatan tertentu dapat ditandai dengan warna feses saat buang air besar. (2) Selain warna feses, feses yang berdarah juga dapat menjadi penanda kondisi kesehatan tertentu. (3) Bahkan, feses yang berdarah perlu menjadi perhatian karena mungkin disebabkan oleh hal yang serius. (4) Ada banyak kemungkinan penyebab feses berdarah yang relatif tidak berbahaya, cukup serius, kondisi sangat serius, dan perawatan segera diperlukan. (5) Darah dalam feses dapat disebabkan oleh perdarahan di saluran gastrointestinal (GI) bagian atas atau bawah dan warna darah dapat membantu menunjukkan sumbernya. (6) Feses yang hitam dan lembek mungkin menunjukkan adanya perdarahan di saluran pencernaan bagian atas. (7) Jika warna darah makin gelap, makin tinggi sumber perdarahannya. (8) Sementara itu, jika darahnya berwarna merah cerah, ini biasanya merupakan tanda terjadinya perdarahan di saluran GI bagian bawah. (9) Selain kondisi-kondisi itu, ada pula kondisi kesehatan lain yang mungkin menyebabkan feses berdarah, seperti gastroenteritis, wasir, dan tukak lambung. (10) Oleh karena itu, feses berdarah tidak boleh dianggap sepele.
Kamu diminta untuk memperbaiki susunan frasa-frasa yang relatif tidak berbahaya, cukup serius, kondisi sangat,serius, dan perawatan segera diperlukan yang terdapat pada kalimat (4). Di antara pilihan jawaban berikut, perbaikan yang paling tepat adalah",0,2,40
18,694,BI,"Pemanasan global, yaitu meningkatnya rata-rata suhu di atmosfer bumi akibat peningkatan gas rumah kaca, menyebabkan terjadinya masalah kekeringan dan berkurangnya curah hujan di banyak wilayah. Hal tersebut berdampak pada berkurangnya pasokan air yang masuk ke dalam tanah. Hal ini tentunya akan menyebabkan masalah pada kuantitas air tanah. Selain itu, pasokan air yang masuk ke dalam tanah akan menjadi bagian dari lapisan tanah. Berkurangnya pasokan air yang menjadi bagian dari lapisan tanah akan mengakibatkan muka air tanah menjadi lebih rendah. Pada saat yang bersamaan, pemompaan dan konsumsi air tanah yang terus meningkat seiring pertumbuhan jumlah penduduk menyebabkan penurunan muka air tanah menjadi makin lebih cepat. Rendahnya muka air tanah juga bisa memicu ketidakseimbangan tekanan dan aliran air. Kondisi ini mengakibatkan aliran air dari air permukaan, seperti sungai, rawa, dan danau, merembes atau terinfiltrasi masuk ke dalam lapisan tanah sehingga air permukaan ini menjadi bagian air tanah. Tidak hanya airnya, polutan yang terkandung dalam aliran air permukaan itu pun juga akan masuk ke dalam lapisan tanah. Polutan ini utamanya berasal dari aktivitas manusia, dan bisa berupa residu obat, sisa-sisa bahan kimia, limbah industri, dan lain-lain. Jika polutan masuk ke dalam lapisan air tanah, hal tersebut akan menyebabkan terjadinya pencemaran air tanah. Saat ini terjadi, kualitas air tanah pun akan menurun. Jadi, pemanasan global yang awalnya berdampak terhadap kuantitas air tanah, ternyata akan berdampak pula pada kualitas air tanahnya.
Apa gagasan utama teks tersebut?",1,1,75
18,697,BI,"Siapkah Indonesia Beralih ke Kendaraan Listrik? Sebagai upaya untuk mengurangi tingkat polusi yang disebabkan oleh penggunaan kendaraan yang berbahan bakar minyak (BBM), masyarakat mulai terdorong dan beralih menggunakan kendaraan listrik yang lebih ramah lingkungan daripada kendaraan konvensional berbahan bakar minyak. Hasil penelitian memang menunjukkan bahwa kendaraan berbahan bakar minyak merupakan penyumbang utama polusi udara berupa karbon monoksida (CO), hidrokarbon (HC), nitrogen oksida (NO), dan debu. Selain itu, cadangan BBM yang terus mengalami penurunan juga menjadi salah satu alasan mengapa banyak masyarakat beralih ke kendaraan listrik. Pemerintah Indonesia mendukung peralihan kendaraan ber-BBM ke kendaraan listrik. Indonesia sudah membuat peta jalan (roadmap) pengembangan industri Kendaraan Bermotor Listrik Berbasis Baterai (KBLBB) melalui Peraturan Menteri Perindustrian Nomor 27 Tahun 2020. Peraturan tersebut disusun sebagai petunjuk bagi pihak-pihak terkait, seperti pelaku industri otomotif, produsen baterai, dan konsumen. Selain peraturan, dukungan pemerintah juga dibuktikan dengan telah disusunnya kebijakan yang memudahkan dan meringankan masyarakat dalam hal kepemilikan kendaraan listrik, seperti pengenaan Pajak Pertambahan Nilai Barang Mewah (PPnBM) sebesar 0% , pajak atas penyerahan hak milik kendaraan bermotor (BBN-KB) sebesar 0% untuk KBLBB di Pemprov DKI Jakarta, BBN-KB sebesar 10% mobil listrik dan 2,5% sepeda motor listrik di Pemprov Jawa Barat, uang muka minimum sebesar 0% dan suku Bungan rendah untuk kendaraan listrik. Dari sisi produsen, pemerintah memberikan kemudahan/keringanan berupa tax holiday, tax allowance (PP 18/2015 Jo PP 9/2016, Permenperin 1/2018), pembebasan bea masuk (PMK 188/2015), bea masuk ditanggung pemerintah, serta super tax deduction untuk kegiatan R&D (PP 45/2019 dan PMK No. 153/2020).
Pernyataan manakah yang sesuai dengan isi teks tersebut?",0,0,41
18,720,BI,"Tjipto Mangoenkoesoemo merupakan seorang dokter lulusan sekolah dokter bumiputra (STOVIA). Setelah lulus pada 1905, beliau kemudian menjadi dokter pemerintah dan dalam kariernya berhasil memerangi penyakit pes di Malang, Jawa Timur. Keberhasilan Tjipto dalam memerangi penyakit pes membuat Pemerintah Kolonial Belanda memberinya penghargaan Willem Klas 3, tetapi penghargaan tersebut ditolaknya. Tjipto kemudian mundur sebagai dokter pemerintah dan memilih terjun dalam dunia politik. Pada tahun 1912, Tjipto Mangoenkoesoemo bersama Soewardi Soerjaningrat dan Douwes Dekker mendirikan sebuah organisasi yang bernama Indische Partij (IP) yang merupakan organisasi pergerakan nasional pertama yang berbasis politik. Dalam perjalanannya, Tjipto dan pendiri IP sempat dibuang ke Belanda akibat tulisan Soewardi Soerjaningrat di surat kabar De Express yang berjudul “Als ik eens Nederlander was” (Seandainya Aku Seorang Belanda) yang mengkritik tindakan Kerajaan Belanda yang merayakan 100 tahun kemerdekaannya dari Prancis di negeri jajahannya, bahkan dengan menggalang dana di Hindia Belanda. Pada 1914, Tjipto kembali ke Jawa karena penyakit asma dan serangan syaraf yang dideritanya selama di Belanda. Sekembalinya ke Jawa, beliau bergabung ke dalam Volksraad (Dewan Rakyat) dan ikut serta dalam pemogokan petani perkebunan di Polanharjo, Klaten pada 1919. Namun, beliau kembali menjalani pembuangan di Banda Neira selama 14 tahun sejak 1927 karena dituduh terlibat dalam persekongkolan dan pemberontakan. Meski menentang kolonialisme Belanda, Tjipto lebih mengkhawatirkan fasisme. Ketika Jerman menduduki Belanda pada 1940, beliau berbalik menunjukkan simpati pada Belanda. Beliau mengirim surat ke majalah politik Nationale Commentaren yang dipimpin oleh Sam Ratulangi. Beliau menulis “Perjuangan di Eropa sekarang itu ialah perjuangan antara demokrasi dengan totalitarianisme. Dalam perjuangan semacam itu tidak salah kita memilih, di manakah akan diletakkan perasaan simpati kita? Sudah tentu di pihak demokrasi”. Beliau pun berkata, “Sekarang kita lebih baik tolong lawan kita itu, Holland ....” Atas sikapnya ini, beliau diejek sebagai orang tua yang pikun. Begitu pula ketika Jepang masuk ke Hindia Belanda, Tjipto mengimbau rakyat agar membantu pemerintah Belanda. Namun, Sutan Sjahrir yang juga menentang fasisme Jepang menilai sikap Tjipto tidak hanya didasarkan atas pertimbangan politik, tetapi juga karena kesehatannya yang memudar. Tjipto menunjukkan komitmennya menentang fasisme Jepang dengan menjadi tuan rumah di Selabintana, Sukabumi, untuk membentuk Gerakan Antifasis (Geraf) pada Mei 1940. Setelah itu, kesehatan Tjipto memburuk. Pada 8 Maret 1943, beliau mengembuskan nafas terakhirnyadi saat Jepang masih menancapkan fasismenya di Indonesia.
Paragraf keempat pada teks tersebut mengandung kesalahan sehingga perlu diperbaiki. Salah seorang temanmu menyarankan lima cara perbaikan yang ia tuliskan dalam pilihan jawaban berikut. Di antara lima cara yang ada, manakah perbaikan yang paling tepat untuk paragraf tersebut?",0,3,27
18,987,PM,"Perjalanan ke kota A lebih lama daripada ke kota B. Perjalanan ke kota D membutuhkan waktu yang sedikit lebih lama daripada perjalanan ke kota C. Perjalanan ke kota D tidaklah lebih lama daripada perjalanan ke kota A, namun lebih lama daripada perjalanan ke kota B.

Manakah urutan waktu perjalanan dari paling singkat ke paling lama yang paling mungkin?",3,3,50
18,860,EN,"In the following article, the author speculates about a connection between the low-fat, high-carbohydrate diet recommended by the medical establishment in the last twenty years and the increasing rate of obesity among Americans. 
American dietitians and members of the medical community have ridiculed low-carbohydrate diets as quackery for the past thirty years, while extolling a diet that cuts down on fat, limits meat consumption, and relies on carbohydrates as its staple. Many Americans are familiar with the food pyramid promoted by the U.S. government, with its foundation of carbohydrates such as breads, rice, and pasta, and its apex allotted to fats, oils, and sweets. Adhering to the government's anti-fat, pro- carbohydrate gospel, food manufacturers have pumped out fat-free grain products that lure consumers with the promise of leaner days. Then, why are Americans getting so fat? Could the dietary recommendations of the last twenty years be wrong? And what's more, could the proponents of diets that push protein and fat be right? 
Fact: Obesity rates have soared throughout the country since the 1980s. The United States Centers of Disease Control reports that the number of obese adults has doubled in the last twenty years. The num-ber of obese children and teenagers has almost tripled, increasing 120% among African-American and Latino children and 50% among white children. The risk for Type 2 diabetes, which is associated with obesity, has increased dramatically as well. Disturbingly, the disease now affects 25% to 30% of children, compared with 3% to 5% two decades ago. 
What is behind this trend? Supersized portions, cheap fast food, and soft drinks combined with a sedentary lifestyle of TV watching or Internet surfing have most likely contributed to the rapid rise of obesity. Yet, there might be more to it: is it a coincidence that obesity rates increased in the last twenty years-the same time period in which the low-fat dietary doctrine has reigned? Before the 1980s, the conventional wisdom was that fat and protein created a feeling of satiation, so that overeating would be less likely. Carbohydrates, on the other hand, were regarded as a recipe for stoutness. This perception began to change after World War II when coronary heart disease reached near epidemic proportions among middle-aged men. A theory that dietary fat might increase cholesterol levels and, in turn, increase the risk of heart disease emerged in the 1950s and gained increasing acceptance by the late 1970s. In 1979, the focus of the food guidelines promoted by the United States Depart-ment of Agriculture (USDA) began to shift away from getting enough nutrients to avoiding excess fat, saturated fat, cholesterol, and sodium-the components believed to be linked to heart disease. The anti-fat credo was born. 
To date, the studies that have tried to link dietary fat to increased risk of coronary heart disease have remained ambiguous. Studies have shown that cholesterol-lowering drugs help reduce the risk of heart disease, but whether a diet low in cholesterol can do the same is still questionable. While nutrition experts are debating whether a low-fat, carbohydrate- based diet is the healthiest diet for Americans, nearly all agree that the anti-fat message of the last twenty years has been over-simplified. For example, some fats and oils like those found in olive oil and nuts are beneficial to the heart and may deserve a larger propor-tion in the American diet than their place at the tip of the food pyra-mid indicates. Likewise, some carbohydrates that form the basis of the food pyramid, like the ""refined"" carbohydrates contained in white bread, pasta, and white rice, are metabolized in the body much the same way sweets are. According to one Harvard Medical School researcher, a breakfast of a bagel with low-fat cream cheese is ""meta-bolically indistinguishable from a bowl of sugar."" 
So what about those high-fat, protein diets that restrict carbohy-drates like the popular Atkins' diet and others? A small group of nutrition experts within the medical establishment find it hard to ignore the anecdotal evidence that many lose weight successfully on these diets. They are arguing that those diets should not be dismissed out of hand, but researched and tested more closely. Still others fear that Ameri-cans, hungry to find a weight-loss regimen, may embrace a diet that has no long-term datal about whether it works or is safe. What is clear is that Americans are awaiting answers and in the meantime, we need to eat something.
The author characterizes the anti-fat message of the last twenty years as",3,1,12
18,962,PM,"Suatu kelompok belajar terdiri dari siswa laki-laki dan siswa perempuan. Salah satu siswa laki-laki bernama Edo dan salah satu siswa perempuan bernama Tari. Banyak teman laki-laki Edo di kelompok belajar tersebut sama dengan setengah dari banyak siswa perempuan. Banyak teman perempuan Tari di kelompok belajar tersebut satu lebihnya dari banyak siswa laki-laki.
Banyak cara memilih 2 orang siswa jika setidaknya terpilih 1 orang siswa laki-laki adalah ….",2,3,47
18,672,BI,"Berbagai kasus ujaran kebencian (hate speech) dari pejabat publik terkadang memberi guncangan politik dan suasana gaduh di tengah masyarakat serta menimbulkan pro dan kontradengan timbulnya berbagai aksi demonstran yang menuntut agar pelakunya ditahan atau melakukan permintaan maaf secara terbuka, baik melalui media massa maupun media cetak. Ujaran kebencian adalah perkataan, perilaku, tulisan, ataupun pertunjukan yang dilarang karena dapat memicu terjadinya tindakan kekerasan dan sikap prasangka bagi korban. Beberapa kasus ujaran kebencian yang menimbulkan pro kontra di tengah Masyarakat menimbulkan pertanyaan. Jika pejabat publik yang melakukan dan dilaporkan ke apparat penegak hukum, pada akhirnya mereka akan bebas dengan hanya meminta maaf. Sebaliknya jika hal tersebut disampaikan oleh orang-orang yang dianggap kristis dan berseberangan dangan penguasa, hampir rata-rata mereka harus berakhir di pengadilan dengan Keputusan melanggar UU ITE dan harus mendekam di lembaga pemasyarakatan. Berulangnya kejadian ujaran kebencian yang berbalut hak imnunitas dari para anggota DPR sepertinya akan terus berulang apalagi menjelang tahun politik pemilihan umum tahun 2024 intensitasnya pasti akan bertambah. (Diadaptasi dari jabar.kemenkumham.go.id)
Kritikan yang tepat terhadap penegak hukum dalam teks tersebut adalah",0,3,29
18,689,BI,"(1) Pada hakikatnya, manusia hidup dalam sebuah kesatuan ruang yang terdiri atas beberapa komponen yang berkaitan. (2) Ruang tersebut dikenal sebagai lingkungan hidup. (3) Dalam perundang-undangan, lingkungan hidup dianggap sebagai kesatuan ruang dengan semua benda, daya, keadaan, dan makhluk hidup termasuk di dalamnya manusia dan perilakunya. (4) Semua hal itu memengaruhi kelangsungan perikehidupan dan kesejahteraan manusia serta makhluk hidup lainnya. (5) Lingkungan hidup terdiri atas tiga komponen utama, yaitu lingkungan alam, lingkungan buatan, dan lingkungan sosial. (6) Lingkungan sosial sangat berpengaruh terhadap pembangunan manusia seutuhnya. (7) Akan tetapi, kebutuhan manusia tidak ada batasnya sering membuat manusia bertindak berlebihan. (8) Mereka mengeksploitasi lingkungan sebesar-besarnya demi memenuhi kebutuhan hidup. (9) Kebutuhan hidup setiap manusia pasti berbeda-beda, bergantung pada jabatan, gaya hidup, usia, dan jenis kelaminnya.
Kalimat (7) perlu disempurnakan dengan cara",2,1,115
18,876,EN,"The Alaska pipeline starts at the frozen edge of the Arctic Ocean. It stretches southward across the largest and northernmost state in the United States, ending at a remote ice-free seaport village nearly 800 miles from where it begins. It is massive in size and extremely complicated to operate. The steel pipe crosses windswept plains and endless miles of delicate tundra that tops the frozen ground. It weaves through crooked canyons, climbs sheer mountains, plunges over rocky crags, makes its way through thick forests, and passes over or under hundreds of rivers and streams. The pipe is 4 feet in diameter, and up to 2 million barrels (or 84 million gallons) of crude oil can be pumped through it daily. 
Resting on H-shaped steel racks called ""bents;' long sections of the pipeline follow a zigzag course high above the frozen earth. Other long sections drop out of sight beneath spongy or rocky ground and return to the surface later on. The pattern of the pipeline's up-and-down route is determined by the often harsh demands of the arctic and subarctic climate, the tortuous lay of the land, and the varied compositions of soil, rock, or permafrost (permanently frozen ground). A little more than half of the pipeline is elevated above the ground. The remainder is buried anywhere from 3 to 12 feet, depending largely upon the type of terrain and the properties of the soil. 
One of the largest in the world, the pipeline cost approximately $8 billion and is by far the biggest and most expensive construction project ever undertaken by private industry. In fact, no single business could raise that much money, so 8 major oil companies formed a consortium in order to share the costs. Each company controlled oil rights to particular shares of land in the oil fields and paid into the pipeline-construction fund according to the size of its holdings. Today, despite enormous problems of climate, supply shortages, equipment breakdowns, labor disagreements, treacherous terrain, a certain amount of mismanagement, and even theft, the Alaska pipeline has been completed and is operating.

Which of the following is the closest in meaning to the phrase resting on (paragraph 2)?",3,0,14
18,1155,PM,"Fungsi f dan g didefinisikan sebagai berikut:
f(x) = x

2 + 4x + 2 dan g(x) = x + 6

Absis terkecil semua titik potong grafik fungsi f dan g adalah...",1,1,62
19,604,BI,"(1) Film ""Penyalin Cahaya"" berhasil memboyong penghargaan tertinggi Malam Anugerah Piala Citra Festival Film Indonesia (FFI) 2021 sebagai Film Cerita Panjang Terbaik. (2) ""Penyalin Cahaya"" juga menjadi juara umum dalam Festival Film Indonesia (FFI) 2021 dengan mengumpulkan 12 Piala Citra dari 17 nominasi yang diterima. (3) Dalam kategori tersebut, ""Penyalin Cahaya"" berhasil mengalahkan ""Ali & Ratu Ratu Queens"". (4) Kemenangan film ini dibacakan oleh Mendikbudristek RI, Nadiem Makarim. (5) Sebelumnya, sutradara Wregas Bhanuteja mendedikasikan film ""Penyalin Cahaya"" sebagai media untuk mengungkapkan isu kekerasan seksual yang selama ini ditutup-tutupi masyarakat Indonesia. (6) la memandang film adalah sarana komunikasi yang paling efisien untuk menyuarakan sebuah kegelisahan yang sedang terjadi di masyarakat. (7) Salah satunya isu kekerasan seksual yang menjadi tema dalam film ""Penyalin Cahaya"". 88 Menurutnya, banyak sekali penyintas yang tidak mendapat keadilan.
Kata ini pada frasa film ini merujuk pada",0,1,73
19,608,BI,"Buku Lincoln the Unknown mengajarkan banyak hal bagi kehidupan Anda dan telah dialami secara pribadi oleh tokoh terkenal dunia, Abraham Lincoln. Pada awal masa karirnya Lincoln adalah seorang ahli kritik dan ahli surat maupun puisi ejekan terhadap orang-orang yang dianggap sebagai lawan. Kemudian surat tersebut dengan sengaja dijatuhkan di jalan-jalan pusat kota agar menarik perhatian. Tak lama kemudian muncullah kemarahan dari seluruh penjuru negeri hingga bertahun-tahun lamanya. Sampai akhirnya Lincoln telah menjadi seorang ahli hukum di wilayah Illinois dan membiarkan kebiasaan mengejek tersebut. Sampai akhirnya puncak kemarahan itu terjadi di tahun 1842, ketika Lincoln mengejek seorang politikus bernama James Shields melalui sepucuk surat. Shields yang marah dan merasa terhina mengajak Lincoln untuk bertarung sampai mati. Kemudian Lincoln belajar menggunakan pedang jenis kavaleri. Sampai akhirnya tiba waktu yang ditentukan dan duel sengit pun terjadi. Keduanya hendak melanjutkan pertarungan hingga akhir, tetapi dihentikan oleh para pendukung keduanya kala itu.
Kalimat yang mengandung makna dari kata sengit pada bacaan di atas adalah",0,3,27
19,1101,PM,"Fungsi f dan g didefinisikan sebagai berikut:
f(x) = x

2 + 4x + 2 dan g(x) = x + 6

Absis terkecil semua titik potong grafik fungsi f dan g adalah...",3,1,23
