ID_USER,ID_QUESTION,Question_Category,Question_Description,USER_ANSWER,CORRECT_ANSWER,Duration
1,1095,PM,"Fungsi f dan g didefinisikan sebagai berikut:
f(x) = x

2 + 4x + 2 dan g(x) = x + 6

Absis terkecil semua titik potong grafik fungsi f dan g adalah...",1,1,40
1,754,EN,"After rising steadily for almost a century, standards of education in the public schools of Europe and North America have leveled off, and in the opinion of many parents and employers, are actually falling. More and more children are leaving school with little more than basic knowledge of reading, writing, and arithmetic, and illiteracy is becoming a social problem once again. With dropout rates of twenty-seven percent in high school and fifty percent in colleges, the American education system is clearly in trouble; European dropout rates, though lower than those of U.S., are rising too. Various factors have been blamed for the apparent decline in educational standards. Some people say that over-crowding and lack of discipline are major factors. Others maintain that subjects like art and drama have been overemphasized at the expense of more practical subjects. The negative influence of television is frequently mentioned as a reason for growing illiteracy. Many teachers and principals, however, insist that the problem is not of falling standards but of rising expectations on the part of parents and employers. Whether or not standards in public schools are actually falling, many parents feel that the only way to secure a good education for their children is to send them to private schools, which generally have smaller classer and stricter discipline. The popularity of such schools is going steadily, despite the high tuition fees. In the United States, for example, eleven percent of all school children attend private schools; in France, over sixteen percent do so.
These following statements are true, except. ",2,2,37
1,869,EN,"As spring arrives, Albeit quite late thus year for many of us, we notice the changing of seasons not only by the weather, but also by a host of natural events. Depending on where you live, the flowers may poke through the snow, the birds may be back, or the cherry trees may bloom. There is an orderly sequence of events that seem to occur, with various spring flowers appearing in order, red maple buds bursting into new leaves, or the old lilac by the barn scenting the air. This seasonal cycle of natural phenomena is called phenology. Global climate change appears to be interfering with the phenology of many species, at the very heart of species interactions. 
In temperate regions like the northern half of the United States, there is comparatively little biological activity in winter. Most plants are dormant, and so are the insects feeding on them. In turn, animals that rely on these insects, such as bats and birds, are hibernating or spending the cold months in more southerly locations. Ectotherms like reptiles and amphibians, which take their body warmth from their environment, also have active phases tied to the seasons. This long winter period constrains all the growing, breeding, and dispersing activities that plants and animals do to a short favorable window. That is what makes spring so vibrant, with plants flowering and putting on new growth, insects emerging and breeding, and birds flying back to take advantage of this shortlived bounty. The onsets of each of these activities add up to so many phonological markers. 
Different organism respond to different cues to initiate seasonal activities. Many plants will start growing leaves again after a set period of dormancy, which very roughly dictates the leaf-out window. Cues that more precisely determine when the buds break can be soil temperature, air temperature, or water availability. Similarly, temperature cues can promote the beginning of insect activity. Day length itself can be the operative trigger for some seasonal events. It is only when there are a sufficient number of daylight hours that reproductive hormones will be produced in many bird species.
The most energy-demanding period in the life of most animals is when they reproduce. For that reason, it is to their advantage to coincide breeding (and for many the raising of young) during a period when food is most abundant. Caterpillars should hatch just as the young tender leaves of oak tree emerge, before they harden and become less nutritious. Breeding songbirds need to time the hatching of their young just during that peak in caterpillar activity, so thay can take advantage of this rich source of protein to feed their offspring. Many species have evolved to exploit peaks in resource availability, so all these seemingly independent phonological events are indeed part of a complex web of precise interactions. Disturbances in seasonal events can have profound effects on ecosystems.

The author's attitude towards the seasonal cycle of natural events is .... ",3,2,52
1,1168,PM,"Fungsi f dan g didefinisikan sebagai berikut:
f(x) = x

2 + 4x + 2 dan g(x) = x + 6

Absis terkecil semua titik potong grafik fungsi f dan g adalah...",3,1,36
1,924,PM,"Pada negara bagian Venezuela, 26 siswa kelas 9 telah disurvey. Hasilnya, 34,6% siswa setidaknya memiliki 2 saudara, Panjang kelas (class size) rata-rata dari kelas 9 di negara bagian Venezuela adalah 26.

Jika murid dari kelas tersebut merepresentasikan semua siswa kelas 9 di negara bagian Venezuela dan terdapat 1.800 siswa kelas 9 di negara bagian tersebut.

Manakah diantara pilihan berikut yang paling mendekati jumlah siswa kelas 8 yang memiliki kurang dari 2 saudara",1,1,72
1,907,PM,"Dalam suatu kelas terdapat 12 murid laki-laki dan 16 murid perempuan. Rata-rata nilai ulangan Matematika di kelas tersebut adalah 80. Setelah melihat hasil tersebut, guru Matematika memberikan kesempatan kepada 4 murid, dengan nilai masing-masing 52, 56, 62, dan 66, untuk melakukan remedial. Diketahui bahwa nilai rata-rata peserta remedial naik 7 poin.

Akan dipilih pengurus inti kelas yang terdiri dari 5 murid. Peluang kelas memiliki satu atau dua murid laki-laki sebagai anggota pengurus inti adalah",3,2,15
1,780,EN,"Technology has revolutionized everything and education is no exception. E-learning has drastically changed the landscape of education. The introduction of e-learning has been convenient for students as well as teachers. As a matter of fact, online education has been received very cordially. Normally, this is not the case for most new things. So, it is safe to say, regarding the future, that e-learning is here to stay. With future updates and upgrades, e-learning is likely to develop and become more convenient for learners. New methods introduced by instructors will make online courses more interesting and engaging for learners. Apart from students, organizations are adapting to e learning courses to train their employees. So, with all the hype and effort combined, the future of e-learning is very unlikely to be bleak. Online learning is a very useful tool for students and young professionals to gain various skills. Any professional can easily learn about any subject they want. This has also empowered individuals to seek, receive, and impart information effectively with very little cost. Almost all online courses are self-paced so students can fit education into their life instead of planning their day-to-day activities around school hours. The recent pandemic situation has suddenly shifted billions of students out of their classrooms. As a result, this has triggered an interest in e-learning among people even more than before. Schools have adopted techniques to keep up with changing times. In one way, the traditional academic education system has kind of normalized e-learning by endorsing their system. Plenty of people got acquainted with e-learning practices during this period. Learners  helped by facilities e are more likely to subscribe to further courses in the future. Young school aged children have already been academically introduced to e-learning so the process is already  quite normal and usual for them.
About e-learning, the statement which is NOT correct is",2,3,19
1,1056,PM,"Fungsi f dan g didefinisikan sebagai berikut:
f(x) = x

2 + 4x + 2 dan g(x) = x + 6

Absis terkecil semua titik potong grafik fungsi f dan g adalah...",0,1,29
1,990,PM,"Jika 3a + 2b = 21, berapa nilai b?

(1)3a = 5b
(2)b merupakan bilangan bulat positif",3,1,63
1,1113,PM,"Fungsi f dan g didefinisikan sebagai berikut:
f(x) = x

2 + 4x + 2 dan g(x) = x + 6

Absis terkecil semua titik potong grafik fungsi f dan g adalah...",2,1,19
2,929,PM,"In the coordinate plane, line g passes through the origin and perpendicular to a line that has slope -3. If points (-6, b) and (a, 1) are on line g, then the value of a – b is ….",1,1,88
2,778,EN,"Technology has revolutionized everything and education is no exception. E-learning has drastically changed the landscape of education. The introduction of e-learning has been convenient for students as well as teachers. As a matter of fact, online education has been received very cordially. Normally, this is not the case for most new things. So, it is safe to say, regarding the future, that e-learning is here to stay. With future updates and upgrades, e-learning is likely to develop and become more convenient for learners. New methods introduced by instructors will make online courses more interesting and engaging for learners. Apart from students, organizations are adapting to e learning courses to train their employees. So, with all the hype and effort combined, the future of e-learning is very unlikely to be bleak. Online learning is a very useful tool for students and young professionals to gain various skills. Any professional can easily learn about any subject they want. This has also empowered individuals to seek, receive, and impart information effectively with very little cost. Almost all online courses are self-paced so students can fit education into their life instead of planning their day-to-day activities around school hours. The recent pandemic situation has suddenly shifted billions of students out of their classrooms. As a result, this has triggered an interest in e-learning among people even more than before. Schools have adopted techniques to keep up with changing times. In one way, the traditional academic education system has kind of normalized e-learning by endorsing their system. Plenty of people got acquainted with e-learning practices during this period. Learners  helped by facilities e are more likely to subscribe to further courses in the future. Young school aged children have already been academically introduced to e-learning so the process is already  quite normal and usual for them.
How does the author organize the ideas in paragraphs 1 and 2?",3,3,37
2,660,BI,"Musibah yang menimpa Tarjono Slamet, 47, puluhan tahun silam membuatnya harus kehilangan kaki kiri. Pada 1990, dia bersama tiga rekan kerjanya di Perusahaan Listrik Negara (PLN) tersengat listrik saat memanjat sebuah trafo yang butuh diperbaiki. Itu adalah saat di mana ia kehilangan kaki kirinya. Tidak hanya kaki, semua jari tangannya beku dalam posisi menutup. Sejak saat itu hidupnya berubah drastis. Karena kondisi fisiknya yang tidak memungkinkan, ia dipindahkan ke bagian administrasi. Slamet pun memutuskan keluar dari pekerjaannya di Klaten, Jawa Tengah karena ia merasa pekerjaannya tidak sesuai dengan keahliannya. Kehilangan pekerjaan membuat Slamet harus pulang ke kampung halaman di Batang, Jawa Tengah. Kepulangannya disambut simpati. Akan tetapi, simpati itu juga dibuntuti oleh stigma negatif masyarakat sebagai seorang difabel. Seluruh anggota keluarga memberinya dukungan moral untuk menjalani program pengembangan keterampilan di Pusat Rehabilitasi Yakkum. Di sana, Slamet juga melakukan pemasangan kaki palsu. Sejak saat itu, terowongan kehidupannya yang gelap gulita sedikit demi sedikit mulai menemukan titik terang. Awalnya Slamet sempat dipercaya mengelola bisnis milik Pusat Rehabilitasi Yakkkum yang memberdayakan para difabel. Mulai dari produksi kerajinan kayu, kain, hingga kerajinan tangan dia pelajari sedalam-dalamnya. Berkat keuletannya, Slamet dikirim ke Auckland, Selandia Baru untuk mengikuti beasiswa kuliah di jurusan Kesejahteraan Sosial. Sepulangnya dari Auckland, pada 2003, ilmu bisnis, pemasaran dan penggalangan dana itu dia gunakan untuk merintis bisnisnya yang bernama CV Mandiri Craft. Dia mengajak 25 rekan difabel di Yakkum untuk merealisasikan ide bisnis mainan anak. Ada alasan tersendiri mengapa dia memilih berbisnis mainan anak. Mainan anak yang dibuatnya berbahan kayu berkualitas dengan cat antiracun sehingga aman untuk anak-anak. Beberapa mainan yang dibuatnya antara lain puzzle dan balok untuk Menyusun bangunan. Sebelum mendesain mainan, Slamet melakukan riset psikologi anak. Dua mainan tersebut dibuat untuk membantu anak melatih kesabaran dan ketelitian. Diadaptasi dari https://jogjapolitan.harianjogja.com/read/2020/09/15/511/1049837/kehilangan-kaki-kiri-tarjono-slamet-semangat-tularkan-makna-hidup
Jika ada anak usia produktif (15 tahun) yang memiliki keterbatasan fisik, seperti tunanetra dan tunadaksa, apakah saranmu untuknya selain bersekolah?",2,1,86
2,785,EN,"When we think of NASA, we think of deep-space exploration. We expect the agency to  be working on questions like what life would be like on Mars or how to build a city on the moon. However, researchers—and astronauts—have been on another kind of mission: to bring space down to Earth and to the developing world. In 2003, the agency teamed up with the United States Agency for International Development (USAID) to form SERVIR. It is an initiative to use data gathered in space to help developing countries combat problems related to climate change. Its name comes from the Spanish word meaning “to serve.” 1 NASA launched satellites years ago for research. 2 These satellites are now sending back information that can help Kenyan farmers protect their crops  from frost. 3 The information can also help Nepalese officials monitor forest fires and  policymakers in Botswana prevent land degradation. 4 The projects are active in more than 30  countries around the globe. 5 These are based on extensive needs assessments conducted by  USAID. 6 The satellite data do not replace on-ground monitoring; rather they serve as an  additional resource. In Bangladesh, for example, NASA has been helping cities prepare for floods up to eight days in advance. The country has low elevation and tropical storms. lt sits at the mouth of the Ganges river and is prone to severe flooding come monsoon season. Like the capital Dhaka, floods have the potential to displace tens of thousands every year. The cities rely heavily on warning systems to predict the water level. The prediction is based on how much rainfall the country gets and which way the water flows. 1 In another example, NASA is using satellite imagery of vegetation health. 2 lndeed,  bringing new technology into developing countries has its set of own challenges. 3 The satellite  measures real-time rainfall to help East African countries monitor for potential crop failures. 4 That way, policymakers know if they have enough food to feed the population. 5 They can also  know if they have to import grains from outside markets months in advance.
Which of the following sentences is NOT relevant to the topic discussed in paragraph 5? ",0,1,20
2,601,BI,"Untuk kali pertama, ilmuwan telah menemukan bukti fisik opal di Mars. Jejak yang terdapat pada batu sebelumnya yang ditemukan di dalam meteorit Mars dapat membantu misi eksplorasi di masa depan untuk menentukan wilayah yang mungkin menyimpan bukti adanya tanda-tanda kehidupan di planet Merah tersebut. Opal itu ditemukan dalam pecahan meteorit Nakhla seberat 1,7 gram, meteorit yang dipasok oleh Natural History Museum di London. Meteorit Nakhla sendiri jatuh di Nakhla, Mesir, pada tahun 1911. Tim peneliti yang berasal dari University of Glasgow mengidentifikasi ciri dari batu permata itu sebagai batu permata berwarna oranye terang, kuning, dan merah. Profesor Martin Lee selaku ketua penelitian ini menjelaskan bahwa penemuan batu opal ini sangat penting bagi perkembangan penelitian Mars. ""Ini kali pertama ada benda dari Mars di Bumi yang mengandung opal,"" jelasnya kepada phys.org. Penemuan batu opal asal Mars diklaim sebagai pencapaian besar. Itu terjadi karena batu opal diketahui bisa menyimpan fosil makhluk hidup dan biasa terbentuk di sekitar sumber air panas yang digemari mikroba. Layaknya di Bumi, batu opal terbentuk di sekitar sumber air panas. Dalam situasi itu, akan hidup mikroba. Batuan opal biasanya menangkap dan mengurung mikroba selama jutaan. tahun. ""Jika memang ada mikroba di Mars, bisa jadi mereka terperangkap di dalam batu opal ini,"" harap Lee. Dikutip dari: nationalgeographic.grid.id
Berdasarkan bacaan tersebut, apa fakta yang disorot oleh Martin Lee?",1,2,10
2,842,EN,"A Food Delivery App That Guarantees a Living Wage 
Workers at London’s Wings co-op get a minimum hourly income, plus benefits 
When Rich Mason quit his job as a theater manager to deliver meals on his bicycle in  2017, he figured it would be a good way of earning some cash while exploring a career change.  But as a rider for a big delivery app, he says, he could barely cover his rent, bringing in as little  as £10 ($13.24) on some days. “It’s a really dehumanizing and horrible experience,” says Mason,  33. “You have no human manager you can talk to. You either get orders through your phone screen or you don’t.” 
That spurred Mason to seek a better way to get meals to hungry folks at home. In July he  started Wings, a cooperative in the North London neighborhood of Finsbury Park that delivers  meals from local restaurants. With £20,000 in government funding and grants from foundations,  Wings has hired a half-dozen riders who work five-hour shifts for a guaranteed wage of £11.05  an hour, the minimum needed to get by in London, according to the nonprofit Living Wage  Foundation. 
Wings is one of scores of cooperatives sprouting up to battle the inequity of part time  jobs, an issue that was made excruciatingly clear as the pandemic fueled soaring demand for  delivery services. Technology companies behind delivery apps are under pressure from investors  and governments to offer better conditions for workers, who are often classed as self-employed  with no benefits or any guarantee of a minimum wage. 
The big apps have dominated the industry so far, because they have vast pools of money  that allow them to build brand awareness and create the complex systems needed to ensure  reliability, says George Maier, a fellow at London School of Economics. But all that spending  hasn’t yielded consistent earnings. Deliveroo and Uber Eats have yet to turn a profit, and  DoorDash was only briefly profitable during the second quarter of 2020 as stay-at-home orders across the U.S. boosted demand for takeout. 
Wings uses a service called CoopCycle, provided by a Paris company that charges about  2% of revenue for software that can track couriers and manage orders from shops and  restaurants. The company has licensed the program to roughly 75 groups across Europe, most of  them less than a year old and about half of which are supported by some form of government  funding, says Adrien Claude, who helps CoopCycle members gain traction. “Every co-op is  running its own business, it’s usually cheaper for restaurants, it’s bike-only,” Claude says. “And  couriers are members, so they want to take care of customers and restaurants.”
The relationship between riders who work five-hour in Wings is similar to that",2,2,55
2,960,PM,"Suatu kelompok belajar terdiri dari siswa laki-laki dan siswa perempuan. Salah satu siswa laki-laki bernama Edo dan salah satu siswa perempuan bernama Tari. Banyak teman laki-laki Edo di kelompok belajar tersebut sama dengan setengah dari banyak siswa perempuan. Banyak teman perempuan Tari di kelompok belajar tersebut satu lebihnya dari banyak siswa laki-laki.
Jumlah seluruh siswa di kelompok belajar tersebut adalah … siswa.",3,3,80
2,658,BI,"SYAIR DAFTAR PUSTAKA Suminto A. Sayuti Kubaca satu satu. Sebuah alfabeta. Dari A sampai pun Z. Artikel dan buku memuat namamu. Mengantar materi. Juga menjadi diri sendiri. Membayang di kalimat-kalimat lengkap. Mengantar Predikat. Juga menyiapkan waktu dan tempat. Sebelum hal-hal terlihat. Di pengantar namamu membayang. Samar. Membuat hatiku tergetar. Lalu mengawang. Daftar isi memang tiada. Tapi halaman persembahan menulis namamu dengan tinta tebal. Dengan huruf kapital. Menulis dan membaca pustaka. Aku kembali ke A. Kembali ke asal mula. Menulis dan membaca pustaka. Aku menuju Z. Kembali ke peta perjalanan. Jalan pulang menuju rumah tujuan. Sebuah simpulan. Sesuai perjanjian. Karna aku paham. Kau menungguku di serambi depan. Merapi, 2022
Penyair ingin menyampaikan mengenai",2,1,66
2,1063,PM,"Fungsi f dan g didefinisikan sebagai berikut:
f(x) = x

2 + 4x + 2 dan g(x) = x + 6

Absis terkecil semua titik potong grafik fungsi f dan g adalah...",0,1,11
2,647,BI,"""Moral dan agama ada pada keindahan kesenian itu. Kalau Eyang puas atas pertunjukan balet itu, ini artinya balet dari Negeri Tirai Besi itu telah berdakwah tentang kebenaran.” Yang dimaksud dari kata Negeri Tirai Besi dalam teks tersebut adalah",0,0,101
3,644,BI,"Untuk sebagian besar spesies hewan, jumlah individu dalam spesies berbanding terbalik dengan ukuran tubuh rata-rata anggota spesies: semakin kecil ukuran tubuh, semakin besar jumlah individu hewan. Tamarin, monyet kecil Amerika Selatan, melanggar aturan ini. Dari sepuluh spesies primata yang dipelajari di Taman Nasional Manu Peru, misalnya, dua spesies tamarin, punggung pelana, dan kaisar, masing-masing menempati urutan kedelapan dan kesembilan yang paling tidak melimpah. Hanya marmoset kerdil, yang lebih kecil lagi, yang jumlahnya lebih sedikit. Kelangkaan tamarin tidak mudah dijelaskan; itu tidak dapat diabaikan sebagai konsekuensi dari diet, karena tamarin memakan campuran buah, nektar, dan mangsa kecil yang sama seperti yang dilakukan beberapa rekan mereka yang lebih besar, termasuk dua capuchin yang dikenal sebagai monyet tupai dan monyet malam. Meskipun proporsi relatif buah yang dikonsumsi agak bervariasi di antara spesies, sulit membayangkan bahwa perbedaan halus seperti itu sangat penting untuk memahami kelangkaan relatif tamarin. Untuk menekankan betapa langkanya tamarin, kita dapat membandingkannya dengan primata omnivora lainnya di komunitas. Dalam hal jumlah individu per kilometer persegi, peringkat mereka jauh di bawah dua capuchin, monyet tupai, dan monyet malam. Dan dalam hal biomassa, atau berat total individu yang menempati satu unit area habitat, setiap spesies tamarin hadir hanya seperdua puluh massa capuchin coklat atau sepersepuluh massa monyet tupai. Untuk mendapatkan perspektif lain, pertimbangkan persyaratan spasial tamarin. Tamarin sangat teritorial, dengan penuh semangat mengusir setiap penyusup yang mungkin tersesat di dalam batas-batas domain mereka yang ditentukan dengan tajam. Kelompok menginvestasikan sebagian besar waktu dan energi mereka untuk berpatroli di batas wilayah mereka, mengumumkan kehadiran mereka kepada tetangga mereka dengan teriakan melengking dan menyapu. Teritorial terpadu seperti itu agak luar biasa di antara primata, meskipun owa dan siamang Asia menunjukkannya, seperti halnya beberapa spesies Dunia Baru lainnya seperti titi dan monyet malam. Monyet titi secara rutin hidup dalam wilayah seluas 6 hingga 2 hektar, dan monyet malam jarang bertahan lebih dari 10 hektar, tetapi kelompok tamarin secara rutin menempati 30 hingga 120 hektar. Yang paling mengejutkan tentang wilayah tamarin adalah ukurannya. Bandingkan ini dengan 1 hingga 2 hektar yang dibutuhkan oleh tupai abu-abu Amerika Utara biasa, mamalia nonteritorial dengan ukuran yang hampir sama. Sekelompok tamarin menggunakan ruang yang sama banyaknya dengan pasukan capuchin coklat, meskipun yang terakhir memiliki berat 15 kali lipat. Jadi, selain langka, tamarin membutuhkan ruang yang tampaknya benar-benar tidak proporsional dengan ukurannya.
Perhatian utama dari bacaan ini adalah untuk",3,2,50
3,1172,PM,"Fungsi f dan g didefinisikan sebagai berikut:
f(x) = x

2 + 4x + 2 dan g(x) = x + 6

Absis terkecil semua titik potong grafik fungsi f dan g adalah...",3,1,74
3,1175,PM,"Fungsi f dan g didefinisikan sebagai berikut:
f(x) = x

2 + 4x + 2 dan g(x) = x + 6

Absis terkecil semua titik potong grafik fungsi f dan g adalah...",1,1,52
3,895,PM,"Dalam suatu gedung teater di Provinsi Suka-Suka terdapat 11 baris kursi. Baris pertama berisi10 kursi, baris kedua berisi 15 kursi, baris ketiga berisi 17 kursi, baris keempat berisi 22kursi, baris ke lima berisi 24 kursi, dan seterusnya mengikuti pola yang sama. Berdasarkaninformasi tersebut, banyaknya kursi pada baris kedua dari belakang adalah … kursi",0,3,116
