ID_USER,ID_QUESTION,Question_Category,Question_Description,USER_ANSWER,CORRECT_ANSWER,Duration
1,139,PU,"SMK merupakan pendidikan menengah vokasi yang dianggap sebagai pencipta sumber daya manusia terampil dan bermutu, masih harus menghadapi rentetan panjang persoalan. Idealnya, sekolah menengah kejuruan (SMK) didesain untuk menciptakan lulusan yang siap masuk dunia kerja dengan kemampuan teknis yang mereka miliki. Sementara, SMK justru tercatat sebagai salah satu penyumbang pengangguran tertinggi.

Berdasarkan data Badan Pusat Statistik (BPS) tahun 2019, tingkat pengangguran terbuka (TPT) selama lima tahun terakhir mengalami penurunan 0,90 persen. Namun, jika dilihat dari pendidikan yang ditamatkan, tenaga kerja yang tidak terserap pasar kerja paling tinggi justru dari lulusan SMK. Pada Agustus 2019, TPT lulusan SMK sebesar 10,42 persen turun 0,82 persen dari tahun sebelumnya (11,24 persen). Persentase itu cukup berjarak dengan TPT SMA (7,92 persen). Sementara secara kuantitas, jumlah lulusan siswa SMK tahun ajaran 2018/2019 sekitar 1,4 juta, berada di bawah lulusan SMA yang sekitar 1,5 juta.

Pengangguran lulusan SMK ini menjadi pekerjaan rumah dunia pendidikan, mengingat saat ini ekonomi Indonesia ditopang oleh sektor industri dengan kontribusi terhadap perekonomian nasional hampir 20 persen. Semestinya, lulusan SMK banyak diserap di sektor industri manufaktur ini. Sementara itu, pemerintah kini kian gencar menambah jumlah SMK untuk menjawab kebutuhan era industri keempat. Beberapa strategi digunakan pemerintah untuk memenuhi tantangan itu. Pemerintah membekukan penambahan SMA, membuka SMK baru, dan bahkan mengonversi SMA menjadi SMK. Strategi tersebut membuahkan hasil jumlah SMK dan siswa SMK semakin meningkat.

Berdasarkan paragraf 1, manakah di bawah ini pernyataan yang BENAR",3,1,94
1,229,PBM,"(1) Perkembangan dunia IPTEK (Ilmu Pengetahuan dan Teknologi) kini makin mengagumkan. (2) Perkembangan tersebut telah membawa manfaat yang luar biasa bagi kemajuan peradaban umat manusia. (3) Jenis-jenis pekerjaan yang sebelumnya menuntut kemampuan fisik yang cukup besar kini relatif sudah bisa digantikan oleh perangkat mesin-mesin otomatis. (4) Seolah sudah mampu menggeser posisi kemampuan otak manusia dalam berbagai bidang ilmu dan aktivitas manusia. (5) Kemajuan teknologi saat ini benar-benar telah diakui dan dirasa mampu memberikan banyak kemudahan serta kenyamanan bagi kehidupan umat manusia. (6) [...], manusia tidak bisa menipu diri sendiri akan kenyataan bahwa kemajuan teknologi yang sering diagung-agungkan itu juga bisa mendatangkan malapetaka dan kesengsaraan bagi manusia modern. (7) Kemajuan teknologi yang semula diciptakan untuk memudahkan manusia ketika urusan itu makin mudah justru memunculkan kesepian dan keterasingan baru, yakni lunturnya rasa solidaritas, kebersamaan, dan silaturahmi. (8) Sebagai contoh, penemuan smartphone telah mengakibatkan sebagian besar masyarakat terlena dengan dunia maya. (9) Karena hampir segala hal bisa dilakukan lewat smartphone, tak sedikit orang yang akhirnya lebih banyak menghabiskan waktu dengan smartphone daripada dengan orang-orang di lingkungan sekitarnya.

Konjungsi yang tepat untuk bagian rumpang pada kalimat (6) adalah",2,2,45
1,295,PPU,"(1) Saat ini, pelaku UMKM harus melek masalah HAKI (hak atas kekayaan intelektual) dan merek.
(2) Bagaimanapun, merek menjadi hal yang sangat penting bagi pelaku UMKM agar produk yang dijualnya memiliki nilai jual yang tinggi.
(3) Sebagai contoh, sebuah produk tanpa merek dibandrol dengan harga Rp5.000,00.
(4) Namun, ketika sudah memiliki merek, harga produk tersebut bisa mencapai Rp40.000,00.
(5) Contoh itu menunjukkan bahwa merek berperan penting dalam meningkatkan nilai jual.
(6) Merek berfungsi sebagai pembeda di antara pesaing yang menjual produk serupa.
(7) Hal itulah yang menjadikan perlunya pelaku UMKM untuk mendaftarkan merek produknya.
(8) Dengan mendaftarkan merek produknya, ada jaminan kepada konsumen untuk membedakan satu produk dengan produk lainnya.
(9) Selain itu, perusahaan juga dapat membedakan produk-produk yang mereka miliki serta menjadikannya sebagai alat pemasaran dan dasar untuk membangun reputasi.

Kata melek pada kalimat (1) memiliki makna ....",2,3,90
1,521,PK,"Diketahui bangun datar sebagai berikut:
1) Persegi panjang bukan persegi
2) Belah ketupat bukan persegi
3) Segitiga sama kaki bukan sama sisi
4) Layang-layang bukan persegi

Ada berapa bangun di atas yang memilki satu simetri putar dan satu simetri lipat",1,1,113
1,548,PK,"(1) 2264
(2) 1710
(3) 496
(4) 1346

Manakah yang merupakan penjumlahan 4 bilangan ganjil",2,3,117
1,378,PPU,"SMA Negeri 2 Jakarta didirikan pada tanggal 24 Februari 1959 dengan proses pengambilalihan sekolah asing melalui program nasionalisasi pemerintah. Sekolah asing yang dinasionalisasi tersebut bernama Kwo Min Tang yang letaknya ada di Jalan Gajah Mada No. 174-175. Berdasarkan keputusan Peperda No. 232, Kwo Min Tang diubah menjadi SMA PPS (Panitia Pengawasan Sekolah). SMA PPS di awasi dan di bina oleh pemerintah dari perwakilan Depdikbud Jakarta Raya.

Pada tanggal 18 Januari 1960, SMA PPS menjadi SMA Nasional Bapergi, tetapi tidak lama kemudian ditutup dan gedungnya dipakai untuk gedung pendidikan nasional. Gedung yang ada di jalan Gajah Mada No 174 diambil alih tanggal 11 juli 1966 yang akhirnya dijadikan apartemen Mediterania. Lalu, berdasarkan SJP No.004/JV/S/PERW/GG/66, gedung yang ada di jalan Gajah Mada No.175 yang akhirnya menjadi gedung sekolah SMA Negeri 2 Jakarta. SMA Negeri 2 Jakarta dipimpin oleh G. S. Panjaitan sebagai kepala sekolah pertama dan T. Simbolon yang merangkap menjadi wakil kepala sekolah, sekretaris, sekaligus pengajar.

Jika melihat bentuk fisik, fasilitas di SMA Negeri 2 Jakarta tergolong memadai dan mendukung pembelajaran, mulai dari kelas, Laboratorium Bahasa, Laboratorium Biologi, Laboratorium Fisika, Laboratorium Kimia, aula, kantin, masjid, koperasi, ruang Audio Visual, UKS, ruang PIK, toilet, ruang Medikom, lapangan upacara, lapangan kecil, ruang OSIS, perpustakaan, sport center, ruang komputer (TIK), Smart Desk Room, lapangan parkir, gazebo, studio, ruang Inspirasi, hingga ruang ESO.

Simpulan yang paling mungkin sesuai dengan teks tersebut adalah ....",2,2,35
1,182,PBM,"(1) Selain itu, mereka juga mengumumkan kerusakan pada organ berupa aritmia jantung atau angina pektoris pun termasuk dalam efek jangka panjang Covid-19. (2) Tidak hanya itu, virus ini juga menyebabkan depresi, insomnia, gangguan makan, berbagai masalah mental, nurologis sehingga kehilangan fungsi tungkai.(3) Namun, satu dampak fisik yang belum tercatat adalah gagal ginjal. (4) Berdasarkan sebuah penelitian di Jurnal Kidney International menyebutkan bahwa dari 5.449 pasien corona yang dites sebanyak 30 persen pasien mengalami masalah ginjal yang parah.(5) Menurut peneliti utama Kenar Jhaveri kepala asosiasi nefrologi di Northwell, lebih dari 14,3 persen dari pasien tersebut memerlukan dialisis ginjal. (6) Dialisis ginjal merupakan penyaringan limbah atau cairan dalam tubuh dengan mesin yang sering disebut dengan cuci darah.

Agar menjadi kalimat yang efektif, kalimat 2 dapat diperbaiki menjadi ",2,1,87
1,277,PPU,"Akibatnya Indonesia tidak bisa membeli persenjataan dari Amerika serikat. Selain itu, Indonesia juga tidak bisa membeli suku cadang untuk perawatan peralatan dari Amerika Serikat. Sebagai contoh, dari belasan pesawat Hercules yang dimiliki Indonesia hanya kurang dari lima pesawat saja yang bisa digunakan.

Untuk melengkapi paragraf tersebut menjadi paragraf deduktif, kalimat utama yang tepat adalah..",0,2,21
1,334,PPU,"Traditional body signage seems largely to have disappeared. Well, many of the old symbols and names are still around, of course, but they are part of the commercial range of options. Seeing someone in a Harvard or Oxford sweatshirt or a kilt or a military tie now communicates nothing at all significant about that person’s life other than the personal choice of a particular consumer. Religious signs are still evocative, to be sure, but are far less common than they used to be. Why should this be? I suspect one reason may be that we have lost a sense of significant connection to the various things indicated by such signs. Proclaiming our high school or university or our athletic team or our community has a much lower priority nowadays, in part because we live such rapidly changing lives in a society marked by constant motion that the stability essential to confer significance on such signs has largely gone.

But we still must attach ourselves to something. Lacking the conviction that the traditional things matter, we turn to the last resort of the modern world: the market. Here there is a vast array of options, all equally meaningless in terms of traditional values, all equally important in identifying the one thing left to us for declaring our identity publicly, our fashion sense and disposable income. The market naturally manipulates the labels, making sure we keep purchasing what will most quickly declare us excellent consumers. If this year a Chicago Bulls jacket or Air Jordan shoes are so popular that we are prepared to spend our way into a trendy identity, then next year there will be something else.

In paragraph 2, disposable income refers to...

",1,1,72
1,220,PBM,"The integration of technology and media can enhance early childhood practice. Successful integration of technology and media into early childhood programs involves the use of resources suchas computers and the Internet in daily classroom practices. True integration occurs when the use of technology and media becomes routine and transparent – when the focus of a child or educator is onthe activity or exploration itself and not on the technology or media being used. Technology integration has been successful when the use of technology and media supports the goals of educators and programsfor children with digital tools for learning and communicating andhelps improve child outcomes.

As the lives of children, parents, families, and educators are infused with technology and media, early childhood classrooms can benefit from the possibilities of extending children’s learning through judicious use these tools. As part of the overall classroom plan, technology and interactive media should be used in ways that support existing classroom developmental and educational goals rather than in ways that distort or replace them. For example, drawing on a touch screen can add to children’s graphic representational experiences; manipulating colorful acetate shapes on a light table allows children to explore color and shape.

By focusing on technology and interactive media as tools-not as ends in and of themselves-teachers can avoid the passive and potentially harmful use of non-interactive, linear screen media that is inappropriate in early childhood settings. Intentionally is a key to developmentally appropriate use. Exciting new resources in today’s technology-rich world represent the next frontier in digital learning for our youngest citizens, leaving it to talented educators and caring adults to determine how best to leverage each new technology as an opportunity for children’s learning in ways that are developmentally appropriate.

The author holds an assumption that",3,3,72
2,90,PU,"(1) Dengan peningkatan produksi dan perbaikan distribusi, maka pertumbuhan ekonomi yang tinggi dapat tercapai tanpa mengorbankan stabilitas harga. (2) Dengan meningkatnya kapasitas perekonomian tersebut menyebabkan tekanan terhadap inflasi akan bekurang sehingga inflasi terus menurun. (3) Inflasi yang rendah dan adanya rencana kenaikan upah berakibat pada daya beli riil masyarakat yang meningkat sehingga konsumsi swasta diperkirakan akan tetap tumbuh dari tahun ke tahun. (4) Pertumbuhan konsumsi swasta tiga tahun terakhir dapat dilihat pada tabel berikut. (5) Sementara itu, dengan daya saing yang meningkat akan berdampak pada tetap tingginya kinerja ekspor. (6) Berbagai pembenahan struktural dilaksanakan pemerintah, seperti perbaikan infrastruktur, perizinan, bea cukai, dan perpajakan diperkirakan memberikan dukungan yang cukup signifikan dalam meningkatkan daya saing produk ekspor Indonesia.

(7) Meski prediksi melambatnya pertumbuhan ekonomi dunia akan berdampak kontradiktif kepada kinerja ekspor Indonesia, harga komoditas yang tetap tinggi dan negara tujuan ekspor yang lebih terdiverivikasi diperkirakan masih akan menghasilkan dampak positif bagi produk ekspor Indonesia. (8) Impor diprediksi juga tumbuh tinggi(14,5%-15,5%) sebagai akibat kuatnya permintaan domestik. (9) Kondisi diatas menyebabkan neraca transaksi akan tetappberada dalam kondisi surolus namun dengan nilai surplus yang terus mengecil. (10) Meskipun surplus neraca transaksi berjalan semakin kecil, namun tingginya aliran masuk FDI diprediksi akan mampu membawa neraca pembayaran dalam kondisi mantap sehingga nilai tukar akan cenderung stabil. (11) pada akhirnya sinergi antara stabilitas ekonomi makro dan perbaikan sisi penawaran diprediksi akan berkontribusi pada peningkatan kesejahteraan masyarakat. (12) Pertumbuhan ekonomi yang diperkirakan tinggi akan mampu menyerap tambahan tenaga kerja sehingga mengurangi pengangguran yang ada. (13) Meningkatnya penyerapan tenaga kerja dibarengi dengan inflasi yang terus menerus berdampak pada pengangguran tingkat kemiskinan.

Kalimat yang tidak efektif terdapat pada",2,3,72
2,210,PBM,"[...] (1) Selama kurun waktu 10 tahun terakhir, kondisi inflasi Indonesiabelum stabil. (2) Kehidupan [...] tidak lepas dari inflasi yang terlihat dari naiknya harga barang-barang kebutuhan pokok dari tahun ke tahun. (3) Definisi konsep nilai waktu uang adalah jumlah [...] yang sama hari ini lebih bermakna daripada esok. (4) Artinya, inflasi dapat mengurangi daya beli uang yang kita miliki sekarang karena menumbuhkan harga terus-menerus. (5) Akibatnya, pendapatan [...] menurun sehingga banyak masyarakat semakin susah memenuhi kebutuhan sehari-harinya. (6) Oleh karena itu, investasi diperlukan untuk melindungi nilai aset atau [...] sehingga dapat digunakan sebagai persiapan kebutuhan di masa depan.

Kata yang paling tepat untuk melengkapi titik-titik pada kalimat 3 adalah",2,0,97
2,463,PPU,"Prociuk baru Harmoni laku keras. Efisiensi yang dilakukan malah menguntungkan perusahaan. Saat ini, pemilik perusahaan semakin gencar untuk menggarap pasar baru di luar India. 
Makna efisiensi pada teks tersebut adalah ....",1,3,79
2,537,PK,"Perbandingan umur Nadia : Bintang 5 tahun yang lalu 5 : 9, selisih umur mereka sekarang 4 tahun. Maka, perbandingan umur Nadia dan Bintang 10 tahun yang akan datang adalah ",2,0,55
2,583,PK,"Agen properti menawarkan lima buah rumah dengan luas dan tipe sama. Harga kelima rumah tersebut ditentukan oleh panorama sekelilingnya.
• Rumah R berharga tiga kali lipat rumah Q.
• Harga rumah S adalah harga rumah R ditambah Q.
• Rumah P dua kali lebih mahal dari rumah Q.
• Rumah T lebih murah dua kali lipat daripada rumah S.

Urutan tiga rumah yang memiliki panorama terindah adalah",3,2,37
2,112,PU,"Sekarang ini penggunaan kendaraan yang ramah lingkungan banyak dilakukan oleh masyarakat. Dengan pemanfaatan ini, konsumsi bahan bakar minyak di masyarakat mampu menghasilkan efisiensi sebesar 20%-30% setiap tahunnya.

Berdasarkan paragraf di atas, manakah yang PALING MUNGKIN menjadi asumsi yang mendasari argumen tersebut",0,2,90
2,77,PU,"(1) Perkembangan teknologi informasi (TI) saat ini ternyata tidak dibarengi dengan filterisasi budaya masyarakat luar yang justru makin mendegradasikan nilai moral anak bangsa. (2) Penggunaan Facebook yang demikian masif ternyata disalahgunakan oleh beberapa pihak untuk melakukan penipuan. (3) Ada banyak kasus penipuan dimasyarakat melalui Facebook: mulai dari kasus gadis dibawa lari oleh orang yang baru dikenal melalui Facebook hingga kasus bunuh diri karena komentar di Facebook. (4) Seharusnya disadari bahwa, dunia maya hanya sekadar gambaran dan bukan realitas yang diciptakan. (5) Semua hal tersebut di dunia maya memang mudah untuk dilakukan. (6) Bahkan, berbagai komentar dan status yang seolah-olah “wah” di depan orang lain tidak hanya mudah mengelabui orang, tetapi juga merusak moral. (7) Tidak sedikit dari para pengguna jejaring sosial yang saling melontarkan komentar negatif dan merendahkan hanya karena status.

(8) Sementara, lewat televisi bisa didapatkan informasi secara lebih cepat. (9) Gambar-gambar yang ditunjukkan oleh televisi sudah mewakili informasi tentang suatu peristiwa yang ingin kita dapatkan. (10) Fungsi televisi sebagai media informasi dan hiburan ternyata tidak dibarengi dengan program-program yang mampu mendidik karakter bangsa. (12) Program televisi, seperti film dan sinetron, justru banyak disalah persepsikan oleh remaja saat ini. (13) Tampaknya, banyak film dan sinetron yang justru tidak bisa mengajarkan bertutur kata yang baik.

Kata ""tersebut"" pada kalimat (5) merujuk pada",0,1,72
2,582,PK,"Jika p > 3 dan q > 4, maka nilai p × q adalah",0,2,25
2,532,PK,"Suatu tes masuk PTN terdiri atas 120 soal. Jika jawaban benar skor 4, salah –1, kosong = 0. Jika Nadia mengerjakan 100 soal dan skor 340 berapa yang dijawab benar",2,2,39
2,340,PPU,"Local legends say that Borneo’s few thousand wild elephants are descendants from those brought to an Island from India or Malaysia as a gift to a sultan in the eighteenth century. Biologists from Columbia University’s Centre for Environmental Research and Conservation compared DNA samples from Borneo elephants with Asian elephants in Sumatra, India and elsewhere. Findings confirmed their (1)_______: Borneo’s elephants are genetically different. In fact, the DNA (2)_______ are so great between them and their closest relatives (elephants in Peninsular Malaysia) that the populations may have separated up to 300,000 years ago, say the scientists. The animals become isolated when the island became totally cut off from the mainland due to a rise in sea level. Borneo’s elephants are, therefore, an important, separate population.

A good title for this passage is ....
",1,2,109
3,2,PU,Lawan kata monoton,2,3,39
3,238,PBM,"(1) Surya Satelit-1 (SS-1), satelit buatan Indonesia, berhasil meluncur menuju International Space Station (ISS). (2) Satelit ini diantar ke ISS dengan menggunakan roket SpaceX, Falcon 9 CRS-26, perusahaan penerbangan luar angkasa besutan Elon Musk. (3) SS-1 mulai mengudara pada 26 November 2022 pukul 14.20 waktu setempat dari NASA Kennedy Space Center, Florida, Amerika Serikat, atau 27 November 2022 pukul 02.20 WIB. (4) Sebagai informasi, satelit SS-1, dikembangkan oleh Universitas Surya yang difasilitasi dan disupervisi oleh Pusat Riset Teknologi Satelit dari BRIN. (5) Projek peluncuran roket pun mendapat dukungan dari Kementerian Komunikasi dan Informatika (Kemenkominfo) serta beberapa pihak lainnya. (6) .... (7) Satelit ini bisa digunakan sebagai sarana komunikasi bagi seluruh laboratorium universitas, perusahaan, hingga radio yang tersebar di seluruh wilayah Indonesia. (8) Tak hanya itu, satelit ini juga bisa menjadi sarana komunikasi Automatic Packet Reporting System (APRS) dalam situasi darurat, yaitu komunikasi yang berbentuk teks singkat. (9) Padahal, dengan APRS, satelit dapat dimanfaatkan sebagai alat mitigasi bencana, pelacakan posisi mobil dan pejalan kaki, pemantauan jarak jauh, komunikasi darurat, serta jaringan internet di hutan.

Pada teks tersebut, penulisan kata serapan yang SALAH terdapat pada",3,2,97
3,397,PPU,"Di era globalisasi seperti yang kita alami saat ini, remaja harus terselamatkan dari dampak negatif globalisasi. Globalisasi mengandung arti mendunia yang diibaratkan dengan kebebasan. Banyak budaya asing yang masuk, sementara budaya tersebut tidak cocok dengan kebudayaan kita yang ketimuran. Sebagai contoh, budaya seks bebas yang marak terjadi di budaya barat kini telah memengaruhi remaja Indonesia. Budaya ini tidak sesuai dengan dasar negara kita, yakni Pancasila. Seks bebas adalah salah satu bentuk perilaku menyimpang. Istilah bebas yang dimaksud adalah melewati batas-batas norma yang ada.

Pada saat ini kebebasan bergaul sudah sampai pada tingkat yang mengkhawatirkan. Sebanyak 63 persen remaja sudah pernah melakukan hubungan seks di luar nikah. Hal ini terbukti pada saat Komisi Perlindungan Anak Indonesia (KPAI) dan Kemenkes melakukan survey pada Oktober 2019. Persentase yang cukup besar ini sangat memprihatinkan dan menarik perhatian. 

Permasalahan seks bebas ini adalah permasalah yang serius dan harus segera diatasi. Hal ini untuk mencegah timbulnya generasi penerus bangsa yang tidak ber-Pancasila. Remaja adalah generasi penerus bangsa yang memegang kunci masa depan bangsa.

Bagaimana sikap penulis terhadap permasalahan yang dibahas dalam bacaan di atas",2,1,29
3,491,PK,"Jika pembilang suatu pecahan ditambah 4 maka nilainya adalah 1. Jika penyebutnya dikurang 1 maka nilainya adalah 1/2, maka pecahan tersebut adalah",0,3,14
3,424,PPU,"(1)Minum air putih atau air mineral merupakan hal yang paling penting dilakukan untuk menjaga kesehatan tubuh. (2).... (3) Dengan minum air putih, tubuh akan terbebas dari segala bentuk toksin yang berbahaya.

(4) Air putih juga mampu memberikan nutrisi penting bagi sel-sel tubuh. (5) Dengan demikian, tubuh akan terus terhidrasi dan saluran pencernaan akan terbantu.

(6) Tubuh kita membutuhkan rata-rata delapan gelas air dalam sehari. (7) Tidak hanya membersihkan tubuh dari berbagai unsur pencemar, tetapi air putih juga mampu mengisi daya tubuh tanpa harus menambah kalori.

(8) Oleh karena itu, air putih sangat penting bagi tubuh manusia. (9) Menjaga tubuh tetap terhidrasi dan minum air putih delapan gelas per hari secara rutin adalah sebuah keharusan.

(10) Dengan demikian, pastikan Anda selalu menyediakan sebotol air minum, baik saat menonton televisi, membaca buku, bermain bersama teman-teman, maupun saat berkendara.

Bentuk ke-an pada kata kesehatan dalam kalimat (1) mempunyai kesamaan makna dengan bentuk ke-an dalam kalimat ...",0,3,91
3,443,PPU,"(1) Indonesia disebut sebagai negara terbesar kedua penyumbang sampah plastik lautan di dunia sehingga Indonesia memiliki target ambisius untuk mengurangi sampah plastik lautan hingga 70 persen pada tahun 2025. (2) Pemerintah Indonesia mungkin harus mempertimbangkan beberapa hal untuk mencapai target tersebut. (3) Penelitian di tahun 2018 mengindikasikan bahwa Sungai Ciliwung, yang membelah ibu kota negara, Jakarta, berada dalam daftar sungai terkotor di dunia. (4) Penelitian yang melibatkan ilmuwan dari Indonesia dan Belanda serta bekerja sama dengan Waste4Change tersebut menemukan bahwa sampel yang diambil dari Sungai Ciliwung tercemar lebih parah ketimbang setidaknya 20 sungai di Eropa dan Asia Tenggara yang juga menjadi subyek penelitian.

(5)Telah dilakukan pengawasan terhadap makroplastik atau plastik dengan ukuran lebih dari 5 milimeter, di lima lokasi sepanjang Sungai Ciliwung pada Mei 2018. (6) Hasilnya, sebanyak 20.000 barang berbahan plastik mengalir ke Laut Jawa setiap jam. (7) Angka tersebut jauh lebih tinggi daripada Sungai Chao Phraya di Thailand sebanyak 5.000 barang per jam, Sungai Seine di Perancis sebanyak 700 per jam, dan Sungai Rhine di Belanda dengan 80 per jam. (8) Selain itu, studi ini juga menghitung berat total sampah plastik dari semua kali-kali di Jakarta mencapai 2,1 juta kilogram. (9) Ini setara dengan 1.000 mobil Tesla Model S.

(10) Penemuan menarik lainnya dari lima lokasi yang telah disurvei, ditemukan lebih banyak kantong plastik dan bungkusan makanan plastik. (11) Hal ini menunjukkan bahwa masyarakat banyak membuang sampah rumah tangga mereka langsung ke sistem air. (12) Selain itu ditemukan bahwa jumlah sampah plastik lebih tinggi saat lebih banyak air. (13) Hal ini menjadi penting karena menunjukkan bahwa sampah plastik akan lebih banyak dialirkan pada musim hujan, yang menjadi puncak aliran air. (14) Apabila Jakarta ingin berkontribusi dalam penurunan polusi plastik global, maka perlu menurunkan sampah plastik sebelum memasuki musim puncak, yaitu musim hujan.

Pernyataan yang sesuai dengan isi bacaan tersebut adalah",0,2,69
3,227,PBM,"Perkembangan teknologi informasi (TI) saat ini ternyata tidak dibarengi dengan filterisasi budaya masyarakat luar yang justru makin mendegradasikan nilai moral anak bangsa. (2) Penggunaan Facebook yang demikian masif ternyata disalahgunakan oleh beberapa pihak untuk melakukan penipuan. (3) Ada banyak kasus penipuan dimasyarakat melalui Facebook: mulai dari kasus gadis dibawa lari oleh orang yang baru dikenal melalui Facebook hingga kasus bunuh diri karena komentar di Facebook. (4) Seharusnya disadari bahwa, dunia maya hanya sekadar gambaran dan bukan realitas yang diciptakan. (5) Semua hal tersebut di dunia maya memang mudah untuk dilakukan. (6) Bahkan, berbagai komentar dan status yang seolah-olah “wah” di depan orang lain tidak hanya mudah mengelabui orang. Tetapi juga merusak moral. (7) Tidak sedikit dari para pengguna jejaring sosial yang salingmelontarkan komentar negatif dan merendahkan hanya karena status.

Apa gagasan utama paragraf tersebut",2,2,89
3,168,PBM,"Dalam pertandingan bulu tangkis Daniel selalu kalah melawan Wisnu, tetapi dalam cabang olahraga yang lainnya ia selalu menang bila bertanding melawan Wisnu. Putra selalu menang dalam pertandingan tenis meja melawan Wisnu, tetapi dalam cabang bulu tangkis ia akan kalah bila bertanding melawan Daniel. Reza adalah pemain bulu tangkis terbaik, tetapi dalam cabang tenis meja dia tidak sebaik Wisnu. Dalam cabang tenis meja, Aldian lebih baik daripada Daniel, sedangkan dalam cabang bulu tangkis ia menempati urutan tepat di bawah Reza.

Siapakah pemain tenis meja terbaik di antara kelima atlet tersebut",1,1,38
3,21,PU,"Semua burung dapat terbang.
Kapal terbang juga dapat terbang. ",2,1,39
