ID_USER,ID_QUESTION,Question_Category,Question_Description,USER_ANSWER,CORRECT_ANSWER,Duration
28,632,BI,"Pengangguran struktural—pengangguran yang bertahan bahkan pada puncak pertumbuhan ekonomi—disebabkan oleh ketidakseimbangan antara jenis dan lokasi pekerjaan yang tersedia di satu sisi dan kualifikasi serta lokasi pekerja di sisi lain. Ketika ketidakseimbangan tersebut terjadi, kekurangan tenaga kerja dan pengangguran dapat terjadi, meskipun ada keseimbangan antara penawaran dan permintaan tenaga kerja dalam perekonomian secara keseluruhan. Karena perubahan teknologi cenderung menggusur beberapa pekerja, ini merupakan factor utama dalam menghasilkan pengangguran struktural. Sementara, kemajuan teknologi hampir selalu menghasilkan pergeseran permintaan untuk berbagai jenis pekerja. Hal itu tidak serta merta mengakibatkan pengangguran. Perubahan permintaan yang relatif kecil atau bertahap cenderung menyebabkan sedikit pengangguran. Di perusahaan individu atau bahkan di pasar tenaga kerja secara keseluruhan, ‘gesekan normal’ mungkin cukup untuk mengurangi jumlah tenaga kerja di pekerjaan yang terkena dampak. Namun, perubahan yang relatif besar atau cepat dapat menyebabkan masalah serius. Pekerja mungkin kehilangan pekerjaan mereka dan menemukan diri mereka tanpa keterampilan yang diperlukan untuk mendapatkan pekerjaan baru. Apakah perpindahan ini menyebabkan pengangguran struktural bergantung pada jumlah sumber daya sektor publik dan swasta yang dikhususkan untuk melatih ulang dan menempatkan para pekerja tersebut. Pekerja dapat didorong untuk pindah ke tempat yang ada pekerjaan, untuk mendidik kembali atau melatih kembali diri mereka sendiri, atau untuk pensiun. Selain itu, faktor lain yang memengaruhi pengangguran structural seperti pergerakan modal dapat dikendalikan. Meningkatnya pengangguran struktural, jika terjadi, mempersulit perekonomian untuk mencapai tingkat pengangguran rendah yang diinginkan bersama dengan tingkat inflasi yang rendah. Jika semakin banyak pekerja yang tidak memiliki keterampilan yang diperlukan untuk pekerjaan yang tersedia, peningkatan total permintaan tenaga kerja akan dengan cepat menimbulkan kekurangan pekerja berkualitas. Ketika upah para pekerja itu dinaikkan, biaya tenaga kerja dan harga juga naik. Fenomena ini mungkin merupakan factor penting dalam tren peningkatan yang diamati selama dua dekade terakhir, pengangguran dikombinasikan dengan inflasi. Kebijakan pemerintah telah memprioritaskan penurunan inflasi, namun upaya ini tetap menyebabkan pengangguran meningkat.
Teks ini menunjukkan bahwa hasil potensial dari pengangguran struktural yang lebih tinggi adalah ....",1,2,45
28,798,EN,"""The researchers point out that it is unclear if the impact of the caffeine on the fetal brain  varies from one trimester to the next, or when during gestation these structural changes  occur."" (Last paragraph of Text 2) 
The idea in the sentence is best restated as",2,3,12
28,683,BI,"(1) Beban berat pada pendidikan tidak bisa dielakkan. (2) Saat ini data lama bersekolah menurun dari 7,9 menjadi 7,6tahun. (3) Angka putus sekolah meningkat menjadi 24 juta. (4) Pemerintah sebenarnya sudah memberikan stimulus agar target minimum dapat dicapai. (5) Relaksasi penggunaan dana BOS dilakukan dan kuota belajar diberikan. (6) Pantauan televisi dan radio pun dimanfaatkan, tetapi tetap saja pembelajaran terganggu. (7) Penyebabnya, guru tidak dapat mengawasi siswa dari jauh, sementara orang tua pun tidak sepenuhnya dapat mendampingi anaknya. (8) Masalah berat bagi siswa perkotaan tersebut terasa lebih pahit bagi siswa perdesaan. (9) Berbagai terobosan tidak berdampak. (10) Relaksasi penggunaan dana BOS pun tidak berpengaruh karena puncak kreativitas sekolah hanya berhenti pada bagi-bagi masker. (11) Jika masalah itu berlarut-larut, desa makin tertinggal.
Kata yang paling tepat menggantikan kata pantauan dalam kalimat (6) adalah",1,0,64
28,1067,PM,"Fungsi f dan g didefinisikan sebagai berikut:
f(x) = x

2 + 4x + 2 dan g(x) = x + 6

Absis terkecil semua titik potong grafik fungsi f dan g adalah...",3,1,30
28,1173,PM,"Fungsi f dan g didefinisikan sebagai berikut:
f(x) = x

2 + 4x + 2 dan g(x) = x + 6

Absis terkecil semua titik potong grafik fungsi f dan g adalah...",0,1,26
28,1067,PM,"Fungsi f dan g didefinisikan sebagai berikut:
f(x) = x

2 + 4x + 2 dan g(x) = x + 6

Absis terkecil semua titik potong grafik fungsi f dan g adalah...",1,1,108
28,722,BI,"Kalimat ketiga paragraf 1 berbunyi sebagai berikut. Keberhasilan Tjipto dalam memerangi penyakit pes membuat Pemerintah Kolonial Belanda memberinya penghargaan Willem Klas 3, tetapi penghargaan tersebut ditolaknya.
Sikap Tjipto Mangoenkoesoemo dalam menghadapi masalah sebagaimana dikisahkan dalam teks tersebut dapat dianalogikan seperti peribahasa",0,0,112
28,683,BI,"(1) Beban berat pada pendidikan tidak bisa dielakkan. (2) Saat ini data lama bersekolah menurun dari 7,9 menjadi 7,6tahun. (3) Angka putus sekolah meningkat menjadi 24 juta. (4) Pemerintah sebenarnya sudah memberikan stimulus agar target minimum dapat dicapai. (5) Relaksasi penggunaan dana BOS dilakukan dan kuota belajar diberikan. (6) Pantauan televisi dan radio pun dimanfaatkan, tetapi tetap saja pembelajaran terganggu. (7) Penyebabnya, guru tidak dapat mengawasi siswa dari jauh, sementara orang tua pun tidak sepenuhnya dapat mendampingi anaknya. (8) Masalah berat bagi siswa perkotaan tersebut terasa lebih pahit bagi siswa perdesaan. (9) Berbagai terobosan tidak berdampak. (10) Relaksasi penggunaan dana BOS pun tidak berpengaruh karena puncak kreativitas sekolah hanya berhenti pada bagi-bagi masker. (11) Jika masalah itu berlarut-larut, desa makin tertinggal.
Kata yang paling tepat menggantikan kata pantauan dalam kalimat (6) adalah",2,0,48
28,836,EN,"Conflicts had existed between Spain and England since the 1570s. England wanted a  share of the wealth that Spain had been taking from the land it had claimed in the Americas. In order to fulfill her desire, Elizabeth I, Queen of England, encouraged her staunch  admiral of the navy, Sir Francis Drake, to raid Spanish ships and towns. Though these raids were  on a small scale, Drake achieved dramatic success, adding gold and silver to England’s treasury  and diminishing Spain’s supremacy. 
Religious differences also caused conflict between the two countries. Whereas Spain was  Roman Catholic, most of England had become Protestant. King Philip II of Spain wanted to  claim the throne and make England a Catholic country again. To satisfy his ambition and also to  retaliate against England’s theft of his gold and silver, King Philip began to build his fleet of  warships, the Spanish Armada, in January 1586. 
Philip intended his fleet to be indestructible. In addition to building new warships, he  marshaled 130 sailing vessels of all types and recruited more than 19,000 robust soldiers and  8,000 sailors. Although some of his ships lacked guns and others lacked ammunition, Philip was  convinced that his Armada could withstand any battle with England.
The martial Armada set sail from Lisbon, Portugal, on May 9, 1588, but bad weather  forced it back to port. Their course was still unchanged, only postponed. Later, the voyage  resumed once more on July 22 after the weather became more stable. 
The Spanish fleet met the smaller, faster, and more maneuverable English ships in battle  off the coast of Plymouth, England, first on July 31 and again on August 2. The two battles left  Spain vulnerable, having lost several ships and with its ammunition depleted. On August 7,  while the Armada laid an anchor on the French side of the Strait of Dover, England sent eight  burning ships into the midst of the Spanish fleet to set it on fire. Blocked on one side, the 
Spanish ships could only drift away. Their crews were in panic and disorder. Before the Armada  could regroup, the English attacked again on August 8. 
Although the Spaniards made a valiant effort to fight back, the fleet suffered extensive  damage. During the eight hours of battle, the Armada drifted perilously close to the rocky  coastline. At the moment when it seemed that the Spanish ships would be driven onto the  English shore, the wind shifted, and the Armada drifted out into the North Sea. The Spaniards  recognized the superiority of the English fleet and returned home, defeated.
King Philip prepared Spanish warships to",2,2,39
29,919,PM,"h = −4,9t2 + 25t

Persamaan di atas menunjukkan perkiraan ketinggian h, dalam meter, dari bola setelah t detik dilemparkan vertikal ke atas dari tanah dengan kecepatan awal 25 m/s. Bola akan kembali ke tanah pada detik berapa",2,3,96
29,850,EN,"Loneliness and social isolation in older adults are serious public health risks affecting a significant number of people in the United States and putting them at risk for dementia and other serious medical conditions. A report from the National Academies of Sciences, Engineering, and Medicine (NASEM) points out that more than one-third of adults aged 45 and older feel lonely, and nearly one-fourth of adults aged 65 and older are considered to be socially isolated. Older adults are at increased risk for loneliness and social isolation because they are more likely to face factors such as living alone, the loss of family or friends, chronic illness, and hearing loss. 
Although it's hard to measure social isolation and loneliness precisely, there is strong evidence that many adults aged 50 and older are socially isolated or lonely in ways that put their health at risk. Recent studies found that social isolation significantly increased a person's risk of premature death from all causes, a risk that may rival those of smoking, obesity, and physical inactivity. Poor social relationships (characterized by social isolation or loneliness) was also associated with a 29% increased risk of heart disease. Loneliness among heart failure patients was associated with a nearly 4 times increased risk of death, 68% increased risk of hospitalization, and 57% increased risk of emergency department visits.
To whom is the text likely addressed?",3,1,19
29,972,PM,"Diketahui x dan y merupakan bilangan ganjil. Manakah yang merupakan bilangan genap?
(1) x + y
(2) 3x + 2y
(3) 3x - 9y
(4) 3x - 2y",3,1,51
29,610,BI,"Buku Lincoln the Unknown mengajarkan banyak hal bagi kehidupan Anda dan telah dialami secara pribadi oleh tokoh terkenal dunia, Abraham Lincoln. Pada awal masa karirnya Lincoln adalah seorang ahli kritik dan ahli surat maupun puisi ejekan terhadap orang-orang yang dianggap sebagai lawan. Kemudian surat tersebut dengan sengaja dijatuhkan di jalan-jalan pusat kota agar menarik perhatian. Tak lama kemudian muncullah kemarahan dari seluruh penjuru negeri hingga bertahun-tahun lamanya. Sampai akhirnya Lincoln telah menjadi seorang ahli hukum di wilayah Illinois dan membiarkan kebiasaan mengejek tersebut. Sampai akhirnya puncak kemarahan itu terjadi di tahun 1842, ketika Lincoln mengejek seorang politikus bernama James Shields melalui sepucuk surat. Shields yang marah dan merasa terhina mengajak Lincoln untuk bertarung sampai mati. Kemudian Lincoln belajar menggunakan pedang jenis kavaleri. Sampai akhirnya tiba waktu yang ditentukan dan duel sengit pun terjadi. Keduanya hendak melanjutkan pertarungan hingga akhir, tetapi dihentikan oleh para pendukung keduanya kala itu.
Pernyataan yang tepat mengenai cara Lincoln untuk menarik perhatian publik adalah",3,3,20
29,734,BI,"Agus, seorang murid kelas 12, sedang memikirkan jurusan kuliah yang tepat. Karena tidak tahu apa saja yang harus dipertimbangkannya, dia melakukan pencarian informasi di internet dan menemukan artikel berikut. 
Tips  Memilih Jurusan Kuliah 
(1) Perhatikan Hobi 
Ketika sedang melakukan hobi, kamu sangat terfokus dan merasakan kesenangan dari kegiatan yang sedang kamu lakukan. Artinya, kegiatan hobimu merupakan ekspresi minat dan bakat yang kamu miliki tapi mungkin belum kamu sadari. Oleh sebab itu, perhatikan jenis hobimu. Jurusan kuliah yang tepat adalah jurusan yang mengembangkan minat dan bakatmu yang sejati. 
(2) Dengarkan Orang Terdekat 
Orang bisa saja keliru atau tidak lengkap dalam menilai dirinya sendiri. Oleh sebab itu, kamu memerlukan masukan dari orang-orang terdekatmu. Mereka memiliki sudut pandang yang berbeda sehingga penilaian mereka atas dirimu barangkali belum atau bahkan tidak akan pernah terpikirkan olehmu. Pilihlah orang-orang dekat yang kamu percayai dan tanya mereka tentang kelebihan dan kekuranganmu. 
(3) Ikuti Tes Minat dan Bakat 
Tes minat dan bakat merupakan cara termudah mengetahui jurusan yang tepat untuk kamu. Tes ini dikembangkan dari hasil penelitian-penelitian psikologis. Kamu diminta untuk menjawab pertanyaan-pertanyaan seputar aktivitas kesukaanmu dan masa depan impianmu. Selain itu, ada juga pertanyaan-pertanyaan yang mengevaluasi kemampuan deduktif, induktif, aritmatika, spasial, dan penalaran. Hasil tes ini akan memperlihatkan 10 rekomendasi jurusan kuliah yang tepat untuk kamu. 
(4) Perhatikan Nilai Rapor 
Laporan hasil pembelajaran di sekolah juga dapat menjadi bahan pertimbanganmu saat memilih jurusan kuliah. Perhatikan nilai-nilaimu yang tinggi, sedang dan kurang. Ingat kembali faktor-faktor penyebab kamu mendapatkan nilai-nilai tersebut. Perenungan ini akan mengungkapkan besar kecilnya minatmu terhadap mata-mata pelajaran tertentu. 
(5) Survei Lapangan Pekerjaan 
Pada akhirnya, lulusan universitas diharapkan dapat memberikan manfaat ekonomi bukan hanya bagi sang lulusan sendiri tapi juga bagi masyarakat luas. Melakukan survei lapangan pekerjaan dapat membantumu memperkecil jumlah pilihan jurusan kuliah sehingga proses pertimbanganmu menjadi lebih mudah. Memilih jurusan kuliah yang tidak berprospek perkembangan ekonomi di masa depan tentunya hanya akan menjadi usaha menjaring angin.
Jika Agus hanya ingin menjalankan tips yang berlandasan ilmiah, ia seharusnya menjalankan tips nomor ….",3,2,65
29,736,EN,"TEXT A - Berlin (Reuters)-No more Coca-Cola or Budweiser, no Marlboro, no American whiskey or even American Express cards a growing number of restaurants in Germany are taking everything American off their menus to protest the war in Iraq. Although the protests are mainly symbolic, waiters in dozens of bars and restaurants in Hamburg, Berlin, Munich, Bonn and other German cities are telling patrons, ""Sorry, Coca-Cola is not available any more due to the current political situation."" The boycotts appear to be part of a nascent worldwide movement. One Web site, www.consumers-against-war.de, calls for boycotts of 27 top American firms from Microsoft to Kodak while another, www.adbusters.org, urges the ""millions of people against the war"" to ""Boycott Brand America."" Consumer fury seems to be on the rise. Demonstrators in Paris smashed the windows of a McDonald's restaurant last week, forcing police in riot gear to move in to protect staff and customers of the American fast-food outlet. The attackers sprayed obscenities and ""boycott"" on the windows. TEXT B This economic advantage, in turn, is used to sponsor terror and killing in Islamic countries such as Afghanistan and Iraq. When product boycott was carried out by consumers in the Middle East and some in the European countries, sales of these companies is reported to be decreased by 10% and this amounted to big numbers for giant companies. Thus, it is a rational for Muslim especially in Malaysia to take similar action. Furthermore, Of late, many other products are available as an alternative for the boycotted products. For example, we have Mukmin toothpaste instead of Colgate etc. and Fab or Breeze could be replaced with Daiya, Puteri Emas etc. There are a few questions arise in regard to the boycott such as how effective is the approach and why not boycotting all the products altogether. In answering these questions, Sabasun has reiterated to look at collapse of the apartheid regime in South Africa as the best example. To answer the question in regard to why not boycotting all the products altogether, Sabasun has taken an approach to do what can be done when one cannot do all. Hence, a few products that are really needed by consumers are offered on a limited floor space and no promotion is done for the product. While products that are boycott completely will not even get space on the shelves let alone floor space. During the early phase after the campaign was in progress, the effect of the boycott is very obvious when Sabasun suffer a loss of nearly RM 150,000.
Both passages are similar in terms of ",1,0,61
29,1075,PM,"Fungsi f dan g didefinisikan sebagai berikut:
f(x) = x

2 + 4x + 2 dan g(x) = x + 6

Absis terkecil semua titik potong grafik fungsi f dan g adalah...",1,1,18
29,829,EN,"There was one group of Americans who actually gained jobs during the Great  Depression: Women. From 1930 to 1940, the number of employed women in the United States  rose 24 percent from 10.5 million to 13 million. Though they’d been steadily entering the  workforce for decades, the financial pressures of the Great Depression drove women to seek  employment in ever greater numbers as male breadwinners lost their jobs. The 22 percent decline  in marriage rates between 1929 and 1939 also created an increase in single women in search of  employment. Women during the Great Depression had a strong advocate in First Lady Eleanor  Roosevelt, who lobbied her husband for more women in office—like Secretary of Labor Frances  Perkins, the first woman to ever hold a cabinet position. 
Jobs available to women paid less but were more stable during the banking crisis:  nursing, teaching, and domestic work. They were supplanted by an increase in secretarial roles in  FDR’s rapidly-expanding government. But there was a catch: over 25 percent of the National  Recovery Administration’s wage codes set lower wages for women, and jobs created under the  WPA confined women to fields like sewing and nursing that paid less than roles reserved for  men. Married women faced an additional hurdle: By 1940, 26 states had placed restrictions  known as marriage bars on their employment, as working wives were perceived as taking away  jobs from able-bodied men—even if, in practice, they were occupying jobs men would not want  and doing them for far less pay.
According to the text, which of the following statements is correct?",2,2,96
29,1136,PM,"Fungsi f dan g didefinisikan sebagai berikut:
f(x) = x

2 + 4x + 2 dan g(x) = x + 6

Absis terkecil semua titik potong grafik fungsi f dan g adalah...",1,1,48
29,805,EN,"Won-pyung Sohn’s first book titled Almond tells the story of a boy who has been  diagnosed with alexithymia, Soon Yunjae. Alexithymia is a condition of emotional absence  restraining the capability to sense and undergo feelings that normal people perceive. 
The title itself refers to Soon Yunjae’s brain tonsils which are the size of an almond. This  is the reason why the young man cannot express emotional feelings. To tackle the given  situation, Yunjae’s mother and grandmother help him learn to communicate in order for him to  survive this judgemental world. Social rules and good behavior principles are taught to him by  both his mother and grandmother. Yunjae has the routine of memorizing, rehearsing, and faking  every feeling that most people learn by mere instinct. He also has to fake his own mood and  learn how to pretend empathy for his peers. 
Almond possesses an afflictive novel of how essential to express emotions and the urge  of living with more empathy and compassion. Sohn engages the readers with heart-wrenching  questions and perceptive comments to be conscious about alexithymia. She also opens our eyes  to how social prejudices should be dismantled. The novel is labeled the Young Adult genre, but  it could be for everyone. Agile and amusing, that’s how the author’s game pen could be  described. Won-pyung Sohn has her own keenness to shake and conquer the reader. Almond is exceptional and has one of those worth-rereading materials. 
Which of the following statements is a fact from the author?",0,3,70
30,664,BI,"1 Wayang orang merupakan seni pertunjukan tradisional khas Jawa dan Bali. 2 Wayang orang disebut juga wayang wong. 3 Pameran wayang orang harus memakai kostum sesuai dengan tema. 4 Tema yang dimainkan dalam wayang orang biasanya mengisahkan tentang Ramayana atau Mahabarata. 5 Yang dikembangkan dalam pertunjukan wayang orang adalah lakon dan tembang. 6 Daerah asal wayang orang adalah tanah Jawa, khususnya Jawa Tengah, di mana Sultan Hamangkurat I sebagai penciptanya pada tahun 1731. 7 Seni pertunjukan wayang orang dikembangkan Keraton Yogyakarta dan Surakarta. 8 Kedua keraton menganggap wayang orang bukan sekadar hiburan, melainkan juga bagian pertunjukan tradisional di daerahnya. 9 Dengan mengutip artikel Transformasi Pertunjukan Wayang Orang Kemunitas Graha Seni Mustika Yuastina Surabaya, wayang orang memuat berbagai seni lain, seperti seni sastra, musik, drama, rupa, dan tari. Diadaptasi dari https://www.kumparan.com/
Kalimat (6) perlu disempurnakan dengan cara ",0,2,90
30,1034,PM,"Fungsi f dan g didefinisikan sebagai berikut:
f(x) = x

2 + 4x + 2 dan g(x) = x + 6

Absis terkecil semua titik potong grafik fungsi f dan g adalah...",3,1,115
30,858,EN,"In the following article, the author speculates about a connection between the low-fat, high-carbohydrate diet recommended by the medical establishment in the last twenty years and the increasing rate of obesity among Americans. 
American dietitians and members of the medical community have ridiculed low-carbohydrate diets as quackery for the past thirty years, while extolling a diet that cuts down on fat, limits meat consumption, and relies on carbohydrates as its staple. Many Americans are familiar with the food pyramid promoted by the U.S. government, with its foundation of carbohydrates such as breads, rice, and pasta, and its apex allotted to fats, oils, and sweets. Adhering to the government's anti-fat, pro- carbohydrate gospel, food manufacturers have pumped out fat-free grain products that lure consumers with the promise of leaner days. Then, why are Americans getting so fat? Could the dietary recommendations of the last twenty years be wrong? And what's more, could the proponents of diets that push protein and fat be right? 
Fact: Obesity rates have soared throughout the country since the 1980s. The United States Centers of Disease Control reports that the number of obese adults has doubled in the last twenty years. The num-ber of obese children and teenagers has almost tripled, increasing 120% among African-American and Latino children and 50% among white children. The risk for Type 2 diabetes, which is associated with obesity, has increased dramatically as well. Disturbingly, the disease now affects 25% to 30% of children, compared with 3% to 5% two decades ago. 
What is behind this trend? Supersized portions, cheap fast food, and soft drinks combined with a sedentary lifestyle of TV watching or Internet surfing have most likely contributed to the rapid rise of obesity. Yet, there might be more to it: is it a coincidence that obesity rates increased in the last twenty years-the same time period in which the low-fat dietary doctrine has reigned? Before the 1980s, the conventional wisdom was that fat and protein created a feeling of satiation, so that overeating would be less likely. Carbohydrates, on the other hand, were regarded as a recipe for stoutness. This perception began to change after World War II when coronary heart disease reached near epidemic proportions among middle-aged men. A theory that dietary fat might increase cholesterol levels and, in turn, increase the risk of heart disease emerged in the 1950s and gained increasing acceptance by the late 1970s. In 1979, the focus of the food guidelines promoted by the United States Depart-ment of Agriculture (USDA) began to shift away from getting enough nutrients to avoiding excess fat, saturated fat, cholesterol, and sodium-the components believed to be linked to heart disease. The anti-fat credo was born. 
To date, the studies that have tried to link dietary fat to increased risk of coronary heart disease have remained ambiguous. Studies have shown that cholesterol-lowering drugs help reduce the risk of heart disease, but whether a diet low in cholesterol can do the same is still questionable. While nutrition experts are debating whether a low-fat, carbohydrate- based diet is the healthiest diet for Americans, nearly all agree that the anti-fat message of the last twenty years has been over-simplified. For example, some fats and oils like those found in olive oil and nuts are beneficial to the heart and may deserve a larger propor-tion in the American diet than their place at the tip of the food pyra-mid indicates. Likewise, some carbohydrates that form the basis of the food pyramid, like the ""refined"" carbohydrates contained in white bread, pasta, and white rice, are metabolized in the body much the same way sweets are. According to one Harvard Medical School researcher, a breakfast of a bagel with low-fat cream cheese is ""meta-bolically indistinguishable from a bowl of sugar."" 
So what about those high-fat, protein diets that restrict carbohy-drates like the popular Atkins' diet and others? A small group of nutrition experts within the medical establishment find it hard to ignore the anecdotal evidence that many lose weight successfully on these diets. They are arguing that those diets should not be dismissed out of hand, but researched and tested more closely. Still others fear that Ameri-cans, hungry to find a weight-loss regimen, may embrace a diet that has no long-term datal about whether it works or is safe. What is clear is that Americans are awaiting answers and in the meantime, we need to eat something.
The passage suggests that the obesity trend in the United States is",1,0,85
