ID_USER,ID_QUESTION,Question_Category,Question_Description,USER_ANSWER,CORRECT_ANSWER,Duration
27,230,PBM,"(1) Perkembangan dunia IPTEK (Ilmu Pengetahuan dan Teknologi) kini makin mengagumkan. (2) Perkembangan tersebut telah membawa manfaat yang luar biasa bagi kemajuan peradaban umat manusia. (3) Jenis-jenis pekerjaan yang sebelumnya menuntut kemampuan fisik yang cukup besar kini relatif sudah bisa digantikan oleh perangkat mesin-mesin otomatis. (4) Seolah sudah mampu menggeser posisi kemampuan otak manusia dalam berbagai bidang ilmu dan aktivitas manusia. (5) Kemajuan teknologi saat ini benar-benar telah diakui dan dirasa mampu memberikan banyak kemudahan serta kenyamanan bagi kehidupan umat manusia. (6) [...], manusia tidak bisa menipu diri sendiri akan kenyataan bahwa kemajuan teknologi yang sering diagung-agungkan itu juga bisa mendatangkan malapetaka dan kesengsaraan bagi manusia modern. (7) Kemajuan teknologi yang semula diciptakan untuk memudahkan manusia ketika urusan itu makin mudah justru memunculkan kesepian dan keterasingan baru, yakni lunturnya rasa solidaritas, kebersamaan, dan silaturahmi. (8) Sebagai contoh, penemuan smartphone telah mengakibatkan sebagian besar masyarakat terlena dengan dunia maya. (9) Karena hampir segala hal bisa dilakukan lewat smartphone, tak sedikit orang yang akhirnya lebih banyak menghabiskan waktu dengan smartphone daripada dengan orang-orang di lingkungan sekitarnya.

Kalimat yang strukturnya TIDAK lengkap terdapat pada",1,1,12
27,387,PPU,"Rasa senang dan susah dikira akan berlangsung terus. Senang dan susah itu sebuah pola jiwa yang senantiasa menyusuri hidup kita. Jadi, apabila ada pendapat rasa senang dan susah itu berlangsung lama, tentu keliru. Bukankah sudah beribu-ribu keinginan yang sudah tercapai, tetapi manusia tetap saja tidak bahagia, melainkan senang sebentar, kemudian susah lagi? Juga, sudah beribu-ribu keinginan yang tidak tercapai, tetapi ia tetap saja tidak celaka, melainkan susah sebentar kemudian senang kembali? Rasa senang dan susah, seakan telah mewarnai seni hidup kita. Jadi, pendapat bahwa tercapainya keinginan menyebabkan rasa bahagia atau tidak tercapainya keinginan menyebabkan celaka, jelaslah keliru. Namun, setiap keinginan pasti disertai pendapat demikian. Sebagai contoh, setiap orang menginginkan sesuatu, misalnya berhajat mengawinkan anaknya dan karena ia tidak punya cukup uang, ia akan mencari pinjaman. Dalam mencari pinjaman tersebut ia merasa, “Jika usahaku untuk mencari pinjaman tidak berhasil, pastilah aku celaka dan
merasa malu selamanya”. Andaikata ia gagal memperoleh pinjaman, ia tidak akan merasa celaka, melainkan hanya merasa malu sebentar.

Kemudian setelah merasa susah karena ia tidak dapat mengundang banyak orang, tidak dapat mengadakan pertunjukan wayang, dan tidak dapat mengadakan janggrungan (tarian bersama antara penari dan tetamu dalam pesta perjamuan orang Jawa), ia pun akan merasa senang lagi bahkan lega hatinya. “Wah, untunglah usahaku mencari utang tempo hari tidak berhasil. Andaikata berhasil, sekarang ini aku akan kelabakan (gelisah) mencari uang untuk membayar utang itu”. Maka jelaslah bahwa tidak tercapainya keinginan itu tidak menyebabkan orang merasa celaka.

Kata wayang pada paragraf ke-3 teks tersebut berarti ",3,0,23
27,525,PK,"Sebuah kkode rahasia disusun terdiri dari 4 digit
• Digit I huruf vocal bukan U
• Digit II diisi dengan angka genap
• Digit III diisi dengan huruf A
• Digit IV diisi dengan angka 0, 1, 2, 3, 4 dan 5

Banyaknya kode rahasia yang dapat dibuat jika setiap digit harus berbeda adalah",0,0,40
27,211,PBM,"[...] (1) Selama kurun waktu 10 tahun terakhir, kondisi inflasi Indonesiabelum stabil. (2) Kehidupan [...] tidak lepas dari inflasi yang terlihat dari naiknya harga barang-barang kebutuhan pokok dari tahun ke tahun. (3) Definisi konsep nilai waktu uang adalah jumlah [...] yang sama hari ini lebih bermakna daripada esok. (4) Artinya, inflasi dapat mengurangi daya beli uang yang kita miliki sekarang karena menumbuhkan harga terus-menerus. (5) Akibatnya, pendapatan [...] menurun sehingga banyak masyarakat semakin susah memenuhi kebutuhan sehari-harinya. (6) Oleh karena itu, investasi diperlukan untuk melindungi nilai aset atau [...] sehingga dapat digunakan sebagai persiapan kebutuhan di masa depan.

Kata yang paling tepat untuk melengkapi titik-titik pada kalimat 5 adalah",1,3,89
27,409,PPU,"Kisah para bandit dalam revolusi Indonesia ini seperti lembaran hitam dan tenggelam dalam keseluruhan cerita heroik tentang masa itu di beberapa daerah di Indonesia. Istilah bandit memiliki banyak sebutan untuk menyebutkan nama bagi mereka yang melakukan tindakan kriminal. Di masa revolusi, seperti ditunjukkan oleh Julianto, memang tidak semua pejuang adalah bandit atau tidak semua bandit adalah pejuang. Ada pejuang yang sungguh-sungguh berjuang atau bandit yang memang membandit selama masa revolusi ini. 

Adapun yang menjadi latar belakang para bandit-bandit revolusi ini melakukan penggrayakan, penggedoran, penggarongan, dan penculikan adalah karena alasan politik, di samping juga ekonomi. Alasan politik dari aksi pemberontakan para bandit itu adalah penolakan terhadap kebijakan rasionalisasi pemerintahan Hatta dan kekecewaan mereka terhadap pembersihan orang-orang komunis setelah peristiwa Madiun 1948. Hal ini muncul karena adanya kebencian Hatta terhadap kaum komunis. Kebijakan yang memangkas sejumlah tentara memang telah menimbulkan kegoncangan di kalangan pejuang dan para laskar.

Sasaran dari kebijakan ini terutama adalah badan-badan perjuangan atau laskar-laskar yang tidak berdisiplin, pantang menyerah, dan tunduk begitu saja pada kebijakan ini. Para anggota badan perjuangan dan laskar-laskar inilah yang menjadi inti dari berbagai kelompok atau gerombolan benggol yang berada di sekiat Surakarta dan melakukan aksi-aksi penggedoran, penjarahan, dan pengeroyokan. Rasionalisasi telah memulangkan tentara ke masyarakat sebanyak 100.000 orang dari jumlah 463.000 tentara dan memberhentikan 80.000 tentara yang dianggap tidak profesional.

Penyebab munculnya konflik yang terdapat pada teks tersebut adalah",0,3,30
27,118,PU,"2,2,5,3,4,7,5,7,10,8,11,14,12,p,q,r 

Nilai p, q, r berturut-turut adalah",0,2,79
27,350,PPU,"Bangsa Sumeria Kuno berkembang ribuan tahun lalu di antara Sungai Tigris dan Efrat. Wilayahnya sekarang disebut Irak Selatan. Sejarawan, Samuel Noah Kramer, menyebutkan bahwa Sumeria Kuno membangun peradaban dengan teknologi yang mutakhir pada zamannya.

Bangsa Sumeria, yang kemudian disebut oleh orang Yunani sebagai Mesopotamia, [....] teknologi baru dan menyempurnakan penggunaan skala besar yang sudah ada. Dalam prosesnya, mereka mereka mengubah cara manusia mengolah makanan, membangun tempat tinggal, berkomunikasi, dan melacak informasi dan waktu.

Seperti yang ditulis Kramer, ada sesuatu dalam identitas Sumeria yang mendorong mereka untuk bermimpi besar dan berpikir cerdik. “Secara spirital dan psikologis, mereka memberikan tekanan besar pada ambisi dan kesuksesan, keunggulan, martabat, kehormatan, dan pengakuan,” jelasnya. Inovasi Sumeria secara bertahap menyebar dan mengarah pada perkembangan dunia modern berteknologi maju yang kita jalani saat ini. Beberapa teknologi Sumeria yang berdampak hingga sekarang adalah tembikar, tulisan, teknik hidrolik, pabrik tekstil, batu bata, dan matematika.

Kata yang tepat untuk mengisi bagian yang rumpang pada paragraf 1 adalah",2,2,28
27,270,PPU,"Nelayan yang berdampak reklamasi Terminal Petikemas pelabuhan Belawan Medan meminta ganti rugi kepada PT Pelabuhan Indonesia I. Nelayan rugi karena reklamasi menutup alur kapal nelayan sehingga mereka harus menambah 1 mil perjalanan setiap hari dengan tambahan 1 liter solar. Perwakilan nelayan terdampak menyampaikan hal tersebut pada rapat dengar pendapat di Dewan Perwakilan Rakyat Daerah Sumatera Utara, Medan. Reklamasi Pelabuhan Belawan sudah berlangsung tiga tahun. Namun, sampai sekarang, nelayan belum mendapat ganti rugi. Rapat yang dipimpin Ketua Komisi B DPRD Sumut itu dihadiri Kepala Bidang Perikanan Tangkap Dinas Pertanian dan Perikanan Kota Medan, Friska Irnawati Purba, serta Kepala Bidang Perencanaan dan Pembangunan Kantor Otoritas Pelabuhan Utama Belawan, Thomas. Octavianus Sipa helut. PT Pelabuhan Indonesia I diundang, tetapi tidak hadir.

Selama tiga tahun mereka belum mendapat ganti rugi. Baru pada 10 April, ada 3.228 nelayan dinyatakan sudah diverifikasi dan akan menerima tali kasih Rp 3.097.000 pernelayan. Delapan orang menerima dana secara simbolis. Sebanyak 300 nelayan tidak masuk dalam daftar nelayan yang terdampak reklamasi yang diverifikasi. Para nelayan hanya minta ganti rugi untuk tambahan bahan bakar selama empat tahun, sekitar 6 juta per nelayan. Petugas Pertanian dan Perikanan Kota Medan kesulitan melakukan verifikasi karena ada penolakan nelayan di lapangan. Akibatnya, sejumlah nelayan yang tidak masuk dalam daftar nelayan yang terdampak. Data hasil verifikasi terhadap 3.228 nelayan sudah final dan tidak ada tambahan lagi.

Pernyataan berikut yang paling benar dari teks tersebut adalah ....",3,3,23
27,390,PPU,"Suasana ini juga yang ada, ketika saya berdiri menghadapi jenazahnya di tengah malam yang dingin, di rumah lurah sebuah desa di kaki Gunung Semeru. Jenazah tersebut dibungkus oleh plastik dan kedua ujungnya diikat dengan tali, digantungkan pada sebatang kayu yang panjang. Kulitnya tampak kuning pucat, matanya terpejam dan dia tampak tenang. Saya berpikir: “Tentunya sepi dan dingin terbungkus dalam plastik itu”. Ketika jenazah dimandikan di Rumah Sakit Malang, pertanyaan yang muncul di dalam diri saya ialah apakah hidupnya sia-sia saja?

Saya sedang duduk, ketika seorang teman yang memesan peti mati pulang. Dia bertanya apakah saya punya keluarga di Malang? Saya jawab, “Tidak. Mengapa?” dia cerita, tukang peti mati ketika dia ke sana bertanya untuk siapa peti mati ini? Teman saya menyebut nama Soe Hok Gie dan si tukang peti tampak agak terkejut. “Soe Hok Gie yang suka menulis koran?” dia bertanya. Teman saya mengiyakan. Tiba-tiba, si tukang peti menangis. Sekarang giliran teman saya yang terkejut. Dia berusaha bertanya, mengapa si tukang peti menangis, tetapi yang ditanya terus menangis dan hanya menjawab “Dia orang berani. Sayang dia meninggal.”

Jenazah dibawa oleh pesawat terbang AURI, dari Malang mampir Yogya kemudian ke Jakarta. Ketika di Yogya, kami turun dari pesawat dan duduk-duduk di lapangan rumput. Pilot yang mengemudikan pesawat tersebut duduk bersama kami. Kami bercakap-cakap. Kemudian dia bertanya, “Apakah benar jenazah yang dibawa adalah jenazah Soe Hok Gie?” saya membenarkan. Dia kemudian berkata, “Saya kenal namanya. Saya senang membaca karangan-karangannya. Sayang sekali dia meninggal. Dia mungkin bisa berbuat banyak, kalau dia hidup terus”.

Pertanyaan berikut yang bisa dijawab oleh teks adalah ",2,1,116
28,141,PU,"SMK merupakan pendidikan menengah vokasi yang dianggap sebagai pencipta sumber daya manusia terampil dan bermutu, masih harus menghadapi rentetan panjang persoalan. Idealnya, sekolah menengah kejuruan (SMK) didesain untuk menciptakan lulusan yang siap masuk dunia kerja dengan kemampuan teknis yang mereka miliki. Sementara, SMK justru tercatat sebagai salah satu penyumbang pengangguran tertinggi.

Berdasarkan data Badan Pusat Statistik (BPS) tahun 2019, tingkat pengangguran terbuka (TPT) selama lima tahun terakhir mengalami penurunan 0,90 persen. Namun, jika dilihat dari pendidikan yang ditamatkan, tenaga kerja yang tidak terserap pasar kerja paling tinggi justru dari lulusan SMK. Pada Agustus 2019, TPT lulusan SMK sebesar 10,42 persen turun 0,82 persen dari tahun sebelumnya (11,24 persen). Persentase itu cukup berjarak dengan TPT SMA (7,92 persen). Sementara secara kuantitas, jumlah lulusan siswa SMK tahun ajaran 2018/2019 sekitar 1,4 juta, berada di bawah lulusan SMA yang sekitar 1,5 juta.

Pengangguran lulusan SMK ini menjadi pekerjaan rumah dunia pendidikan, mengingat saat ini ekonomi Indonesia ditopang oleh sektor industri dengan kontribusi terhadap perekonomian nasional hampir 20 persen. Semestinya, lulusan SMK banyak diserap di sektor industri manufaktur ini. Sementara itu, pemerintah kini kian gencar menambah jumlah SMK untuk menjawab kebutuhan era industri keempat. Beberapa strategi digunakan pemerintah untuk memenuhi tantangan itu. Pemerintah membekukan penambahan SMA, membuka SMK baru, dan bahkan mengonversi SMA menjadi SMK. Strategi tersebut membuahkan hasil jumlah SMK dan siswa SMK semakin meningkat.

Berdasarkan paragraf 3, manakah pernyataan di bawah ini yang PALING MUNGKIN benar mengenai strategi pemerintah terhadap pendidikan SMK",0,1,26
28,234,PBM,"(1) Hasil temuan baru dari University of Georgia menunjukkan bahwa sedikit stres sebenarnya bisa sangat bermanfaat bagi tubuh dan otak. (2) Pasalnya, stres pada tingkat ringan dapat mendorong seseorang untuk keluar dari zona nyaman dan hal itu baik untuk meningkatkan kerja otak. (3) Tim peneliti juga mengatakan bahwa tingkat stres yang rendah hingga sedang dapat meningkatkan kemampuan otak dalam merekam memori kerja. (4) Memori kerja mengacu pada informasi jangka pendek yang digunakan orang untuk menyelesaikan tugas sehari-hari. (5) Contoh, mengingat nomor telepon seseorang atau mengingat arah saat mengemudi. (6) Namun, perlu ditekankan kembali bahwa manfaat tersebut hanya terbatas pada stres ringan hingga sedang. (7) Jika stres telah mencapai tingkat tinggi, kondisi itu justru dapat merusak kesehatan seseorang.

Kata yang harus dihilangkan pada kalimat (1) adalah",0,0,76
28,380,PPU,"Arus globalisasi saat ini telah menimbulkan pengaruh terhadap perkembangan budaya bangsa Indonesia. Derasnya arus informasi dan telekomunikasi ternyata menimbulkan sebuah kecenderungan yang mengarah terhadap memudarnya nilai-nilai pelestarian budaya. Perkembangan 3T (Transportasi, Telekomunikasi, dan Teknologi) mengakibatkan berkurangnya keinginan untuk melestarikan budaya negeri sendiri.

Budaya Indonesia yang dulunya ramah-tamah ,gotong royong, dan sopan berganti dengan budaya barat. Di Tapanuli (Sumatera Utara) misalnya, dua puluh tahun yang lalu, anak-anak remajanya masih banyak yang berminat untuk belajar tari Tor-tor dan Tagading (alat musik Batak). Saat ini, ketika teknologi semakin maju, ironisnya kebudayaan daerah tersebut semakin lenyap di masyarakat. Padahal, bila dikelola dengan baik, kebudayaan tersebut dapat menjadi pariwisata budaya yang mengahasilkan pendapatan untuk pemerintah, baik pusat maupun daerah.

Derasnya arus informasi, yang ditandai dengan hadirnya internet, turut serta menyumbang bagi perubahan tata cara berpakaian dan berbahasa. Pakaian mini dan ketat telah menjadi tren di kalangan anak muda. Selain itu, kita juga sering mendengar anak muda yang menggunakan bahasa Indonesia dicampur dengan bahasa Inggris atau bahasa lainnya yang sering disebut dengan bahasa gaul. Hal ini tentu akan mempengaruhi kelestarian penggunaan bahasa Indonesia yang baik dan benar.

Frasa ""hal ini"" pada paragraf 3 mengacu pada",1,1,27
28,509,PK,"Manakah pernyataan yang benar jika |2x – 5| <3  dengan x adalah bilangan bulat?

(1) HP = {1,2,3,4}
(2) HP ={x|1 < x < 4, x ∈ Ζ}
(3) Jumlah seluruh nilai x adalah 10
(4) Hasil kali seluruh nilai x adalah 6",3,2,25
28,406,PPU,"Revolusi itu bukan sebuah ide yang luar biasa, dan istimewa, serta bukan lahir atas perintah seorang manusia yang luar biasa. Kecakapan dan sifat luar biasa dari seseorang dalam membangun revolusi, melaksanakan atau memimpinnya menuju kemenangan, tak dapat diciptakan dengan otaknya sendiri. Sebuah revolusi disebabkan oleh pergaulan hidup, suatu akibat tertentu dari tindakan-tindakan masyarakat.

Dalam kata-kata yang dinamis, dia adalah akibat tertentu dan tak terhindarkan yang timbul dari pertentangan kelas yang kian hari kian tajam. Ketajaman pertentangan yang menimbulkan pertempuran itu ditentukan oleh pelbagai macam faktor: ekonomi, sosial, politik, dan psikologis. Semakin besar kekayaan pada satu pihak, semakin beratlah kesengsaraan dan perbudakan di lain pihak. Pendeknya, semakin besar jurang antara kelas yang memerintah dengan kelas yang diperintah, semakin besarlah hantu revolusi.

Tujuan sebuah revolusi ialah menentukan kelas mana yang akan memegang kekuasaan negeri, politik dan ekonomi, dan revolusi itu dijalankan dengan “kekerasan”. Di atas bangkai yang lama berdirilah satu kekuasaan baru yang menang. Demikianlah masyarakat feodal didorong oleh masyarakat kapitalis dan yang disebut lebih akhir ini sekarang berjuang mati-matian dengan masyarakat buruh yang bertujuan mencapai “satu masyarakat komunis yang tidak mempunyai kelas”.

Ide pokok paragraf ke-2 adalah ....
",2,3,10
28,148,PU,"Semua kue adalah manis,
Semua kue adalah coklat.",2,0,84
28,488,PK,Selembar papan mempunyai panjang 6 kaki akan dipotong-potong selebar 6 inchi. Menjadi berapa potong papan tersebut,2,3,86
28,263,PBM,"Perubahan iklim terhadap kualitas udara di dunia selalu dilaporkan oleh World Meteorological Organization (WMO) setiap tahun (1). Menurut.., musim panas tahun 2022 adalah musim panas terpanas yang pernah tercatat di Eropa (2). Rekor ini kemudian terpecahkan pada 2023 (3). Gelombang panas yang berkepanjangan menyebabkan peningkatan konsentrasi materipartikulat (PM) 2,5 dan ozon di permukaan tanah (4). Ratusan lokasi pemantauan kualitas udara mencatat 100 mikron per meter kubik paparan selama delapan jam, melampaui tingkat pedoman kualitas udara ozon WHO (5). Hal tersebut pertama kali terjadi di barat daya Eropa, lalu ke Eropa Tengah, dan menyebar ke seluruh benua (6). Selama paruh kedua bulan Agustus 2022, terjadi intrusi debu gurun yang sangat tinggi di Mediterania dan Eropa (7). Campuran suhu tinggi, aerosol yang tinggi, serta kandungan PM 2,5 berdampak terhadap kesehatan serta kesejahteraan manusia (8).

Kalimat yang paling tepat sebagai kalimat inti nomor (1) adalah",0,2,65
28,332,PPU,"Traditional body signage seems largely to have disappeared. Well, many of the old symbols and names are still around, of course, but they are part of the commercial range of options. Seeing someone in a Harvard or Oxford sweatshirt or a kilt or a military tie now communicates nothing at all significant about that person’s life other than the personal choice of a particular consumer. Religious signs are still evocative, to be sure, but are far less common than they used to be. Why should this be? I suspect one reason may be that we have lost a sense of significant connection to the various things indicated by such signs. Proclaiming our high school or university or our athletic team or our community has a much lower priority nowadays, in part because we live such rapidly changing lives in a society marked by constant motion that the stability essential to confer significance on such signs has largely gone.

But we still must attach ourselves to something. Lacking the conviction that the traditional things matter, we turn to the last resort of the modern world: the market. Here there is a vast array of options, all equally meaningless in terms of traditional values, all equally important in identifying the one thing left to us for declaring our identity publicly, our fashion sense and disposable income. The market naturally manipulates the labels, making sure we keep purchasing what will most quickly declare us excellent consumers. If this year a Chicago Bulls jacket or Air Jordan shoes are so popular that we are prepared to spend our way into a trendy identity, then next year there will be something else.

What is most likely the author’s main purpose of writing this passage?",0,0,102
28,541,PK,"Nadia balls are more than Bintang. If Bintang has x balls and Nadia gives 5 balls Bintang  they will have same balls’, Now Nadia’s balls",1,2,108
29,147,PU,"Semua sinden pandai menari tradisional.
Sinden yang bernama Wening tidak dapat menari tradisional di panggung.",0,3,48
29,173,PBM,"(1) Pusat Permodelan Matematika dan Simulasi (P2MS) Institut Teknologi Bandung (ITB) melakukan simulasi dan permodelan sederhana mengenai prediksi [....] virus corona atau Covid-19 di Indonesia. (2) Hasilnya, Indonesia diprediksi akan mengalami puncak kasus harian Covid-19 pada akhir Maret 2020 hingga pertengahan April 2020. Nuning, tim peneliti ITB, menjelaskan penelitian tersebut dilatarbelakangi kasus Covid-19 di Indonesia yang menjadi bagian pandemi global. (4) Kondisi ini melahirkan riuh rendah serta kontroversi, apakah tindakan yang diambil cukup untuk menangkal penyebaran atau berlebihan. (5) Kesimpangsiuran informasi tentang hal ini dikhawatirkan mengganggu usaha nyata untuk menanggulangi bencana yang sebenarnya. (6) Dalam penelitian yang menjadi jurnal ilmiah tersebut, tim peneliti membangun model representasi jumlah kasus Covid-19 dengan menggunakan model Richard’s Curve. (7) Model tersebut terbukti berhasil memprediksi awal, akhir, serta puncak pandemi SARS di Hong Kong pada 2003. (8) [....] memilih penelitian, mereka menguji berbagai data kasus Covid-19 terlapor dari berbagai negara, seperti China, Iran, Italia, Korea Selatan, dan Amerika Serikat, termasuk data akumulatif seluruh dunia.

Apa judul yang tepat untuk teks tersebut",3,2,95
29,417,PPU,"(1)Dalam hal privasi data, aplikasi di ponsel cenderung tidak aman. (2)Oleh karena itu, penting mengamankan data pribadi, terutama jika menyangkut aplikasi yang digunakan. (3)Banyak cara untuk menemukan atau menghapus data yang dapat kita pelajari.

(4)Selain itu, kita juga bisa mempelajari cara melindungi privasi data dan meningkatkan keamanan ponsel. (5) Salah satu di antaranya adalah menggunakan pengelola kata sandi.

(6)Kata sandi yang terkuat adalah karakter acak. (7)Karakter acak ini terdiri atas serangkaian huruf, angka, dan simbol tanpa urutan tertentu yang cenderung tidak ditemukan dalam kamus, pemecahannya oleh komputer sulit, dan hacker sulit meretas.

(8)Kelemahan karakter acak adalah kata sandi yang rumit dan cenderung sulit diingat. (9)Di sinilah aplikasi pengelola kata sandi berguna.

(10) Pengelola kata sandi menyimpan semua kata sandi dalam satu aplikasi terenkripsi dan dilindungi oleh kata sandi. (11)Aplikasi pengelola sandi menghasilkan dan mengingat kata sandi dengan kuat. (12) Dengan pengelola kata sandi, setiap akun dapat memiliki kata sandi yang berbeda, rumit, dan sulit diretas.

Frasa yang cenderung tidak ditemukan dalam kamus, pemecahannya oleh komputer sulit, dan hacker sulit meretas pada kalimat (7) akan menjadi benar bila susunannya ....",3,3,12
29,526,PK,"Untuk melindungi laptopnya agar tidak dapat dibuka oleh teman-temannya, Rino memasang sandi password yang terdiri dari 4 digit yang terdiri dari angka dan huruf vokal dengan ketentuan sebagai berikut:
• Angka, huruf, angka, huruf
• Angka pertama adalah ganjil
• Angka kedua dipilih dari (0,2,5,8)
• Huruf pertama bukan A
• Huruf kedua O

Tentukan berapa banyak susunan password yang bisa dibentuk jika setiap digitnya tidak boleh berulang",3,0,55
29,286,PPU,"(1) Tol laut berbeda dengan tol yang ada di darat.
(2) Tol laut menyediakan fasilitas penyeberangan antarpulau bagi kapal-kapal.
(3) Pembangunan tol laut ini memiliki berbagai dampak positif bagi Indonesia yang merupakan negara kepulauan.
(4) Salah satu contoh dampak positif dari pembangunan tol laut yang nantinya akan dijalankan adalah membuat penduduk yang ada di Pulau Papua makin mudah berdagang dengan penduduk yang ada di Pulau Jawa.
(5) Dengan melihat dampak positif yang ada, pada pemerintahan saat ini, pembangunan tol laut makin digencarkan.
(6) Namun, pembangunan tol laut ini tidak serta merta mendapat respons positif dari seluruh kalangan masyarakat.
(7) Ada beberapa kalangan atau kelompok masyarakat yang menolak pembangunan tol laut.
(8) Pada dasarnya, kalangan tertentu tersebut tidak sepenuhnya menolak pembangunan tol laut.
(9) Penolakan mereka sebenarnya didasarkan pada beberapa kekhawatiran, seperti hanya akan digunakannya tol laut untuk kampanye para elite politik.
(10) Mereka juga khawatir jika sarana dan prasarana yang digunakan untuk pembangunan tol laut sepenuhnya diambil dari barang impor sehingga pembangunan tol laut justru akan membahayakan industri kapal dalam negeri ke depannya.
(11) Namun, meski ada beberapa penolakan, pemerintah terlihat tetap mantap untuk melanjutkan program pembangunan tol laut sebab dampaknya dianggap bisa memberikan peningkatan kesejahteraan bagi masyarakat di wilayah pesisir.

Tujuan penulis menuliskan kalimat (4) pada teks tersebut adalah ....",0,0,54
29,96,PU,"(1) Lembaga KPPOD bekerja sama dengan USAID dan The Asian Foundation (TAF) mengadakan survei daya saing daerah berdasarkan level economic governance. (2) Survei tersebut dilakukan pada 243 kabupaten/kota yang tersebar pada 15 provinsi di Indonesia. (3) Indikator kinerja yang digunakan dalam survei ini adalah manajemen infrastruktur, aksesbilitas, kepastian lahan, dan program pengembangan sektor swasta. (4) Di samping itu terdapat empat indikator kinerja lainnya, yakni hubungan antara pemerintah daerah dan bisnis, biaya transaksi, integretas, dan resolusi konflik, serta kualitias dari peraturan daerah.

(5) Berdasarkan hal tersebut disusunlah indeks tata kella ekonomi/ economic government index (EGI). (6) pembobotan untuk masing-masing indeks disusun menurut presentase perusahaan di mana memandang indeks tersebut sebagai masalah utama yang memengaruhi lingkungan bisnis. (7) hasilnya adalah empat permasalahan utama yang terdapat dalam
pengelolahan ekonomi lokal di Indonesia terdiri atas permasalahan manajemen infrastruktur, pembangunan sektor swasta aksesbilitas dan kepastian lahan, serta hubungan pemda dn sektor bisnis. (9) masing- masing permaslahan ini diberi bobot secara berurutan, yakni 35,5%, 14,8%, dan 14%. (10) berdasarkan hasil survei terdapat empat provinsi yang konsisten memporoleh nilai EGI.

Berdasarkan paragraf tersebut pernyataan yang benar adalah",2,3,28
